Lehigh Valley Health Network- Muhlenberg (Lehigh Valley Health Network- Muhlenberg Cardiac Rehabilitation),"2649 Schoenersville Raod Suite 103 Bethlehem, PA 18017",40.64592,-75.4075,Pennsylvania
Lehigh Valley Hospital - Hazleton (Lehigh Valley Hospital - Hazleton Cardiac Rehabilitation),"Health & Wellness Center at Hazleton 50 Moisey Drive, Suite 107 Hazleton, PA 18202",40.98822,-76.0172,Pennsylvania
Lehigh Valley Hospital - Pocono (Lehigh Valley Hospital - Pocono Cardiac Rehab),"206 East Brown Street East East Stroudsburg, PA 18301-3094",40.99289,-75.1744,Pennsylvania
Lehigh Valley Hospital - Schuylkill (Alcoa Cardiac Rehabilitation),"700 E. Norwegian Street Pottsville, PA 17901",40.69078,-76.1884,Pennsylvania
Lewis Gale Medical Center (Cardiac Rehabilitation & Wellness),"1900 Electric Road Salem, VA 24153",37.2632,-80.0313,Virginia
Lexington Medical Center - Irmo (Cardiac Rehabilitation),"7033 Saint Andrews Rd Ste 103 Columbia, SC 29212-1180",34.07716,-81.1788,South Carolina
Lexington Medical Center - West Columbia (Lexington Medical Center - West Columbia Cardiac Rehabilitation),"Lexington Medical Center 2720 Sunset Boulevard West Columbia, SC 29169",34.00676,-81.1135,South Carolina
Lexington Medical Center-Lexington (Lexington Medical Center-Lexington Cardiovascular Rehabilitation),"811 West Main Street Suite 212 Lexington, SC 29072",33.98355,-81.2511,South Carolina
Liberty Hospital (Liberty Hospital Cardiac Rehab),"2525 Glenn Hendren Dr Liberty, MO 64068-9625",39.27404,-94.4244,Missouri
Licking Memorial Hospital (Licking Memorial Hospital Cardiac Rehab),"1320 West Main St. Newark, OH 43055",40.04829,-82.4502,Missouri
Life Care Center of Gray (Life Center of Gray - Therapy),"791 Old Gray Station Road Johnson City, TN 37615",36.40533,-82.4408,Tennessee
LifeCare Medical Center (LifeCare Medical Center Cardiac Rehab),"715 Delmore Dr Roseau, MN 56751-1534",48.83929,-95.7605,Minnesota
Lifeline Therapy - Forest Hills (Lifeline Cardiac Therapy - Forest Hills),"100 Forest Hills Plz Pittsburgh, PA 15221-5211",40.43505,-79.8621,Pennsylvania
Lifeline Therapy - Monroeville (Lifeline Therapy Cardiac Rehab - Monroeville),"1 Monroeville Ctr 3824 Northern Pike, Ste 660 Monroeville, PA 15146-4048",40.4375,-79.781,Pennsylvania
Lifeline Therapy Centers (Pulmonary Rehabilitaion),"100 Forest Hills Plaza Pittsburgh, PA 15221",40.43505,-79.8621,Pennsylvania
Lima Memorial Health System (Lima Memorial Health System Cardiac Rehab),"1003 Bellefontaine Avenue Suite 201 Lima, OH 45804",40.73478,-84.0851,Ohio
"LIMA MEMORIAL HEALTH SYSTEM (CARDIAC REHAB PROGRAM, CARDIAC TREATMENT CENTER)","1001 Bellefontaine Ave. Lima, OH 45804",40.73556,-84.0859,Ohio
Logan County Hospital (Logan County Rehabilitation & Wellness),"211 Cherry Ave Oakley, KS 67748-1218",39.12706,-100.863,Kansas
Logan Health - Conrad (Logan Health - Conrad Cardiac Rehab),"805 Sunset Blvd Conrad, MT 59425-1717",48.17447,-111.959,Montana
Logan Health Shelby (Logan Health Shelby Cardiac Rehabilitation),"640 Park Ave Shelby, MT 59474-1663",48.50975,-111.849,Montana
Logan Health Whitefish (Logan Health Whitefish Cardiac Rehabilitation),"1600 Hospital Way Whitefish, MT 59937-7849",48.3807,-114.331,Montana
Logan Regional Hospital (Logan Regional Hospital Cardiac Rehabilitation Program),"1400 North 500 East Logan, UT 84341",41.75578,-111.82,Utah
Logansport Memorial Hospital (Logansport Memorial Hospital Cardiac Rehabilitation),"1101 Michigan Ave. Logansport, IN 46947",40.76332,-86.3622,Indiana
Loma Linda University Medical Center (Cardiovascular Health and Wellness),"25583 Prospect Avenue Loma Linda, CA 92354",34.05006,-117.246,California
Long Beach Memorial Medical Center (Long Beach Memorial Medical Center Cardiac Rehab),"2801 Atlantic Ave Long Beach, CA 90806",33.80835,-118.187,California
Longview Regional Medical Center (Cardiopulmonary Rehabilitation),"2901 N. 4th St. Longview, TX 75605",32.53342,-94.7308,Texas
Los Alamitos Medical Center (Long Beach Memorial Medical Center Cardiopulmonary Rehabilitation),"2801 Atlantic Ave Long Beach, CA 90806",33.8085791531152,-118.186751490331,California
Los Robles Hospital and Medical Center (Los Robles Hospital and Medical Center Cardiac Rehabilitation),"150 Via Merida Westlake Village, CA 91362",34.15505,-118.816,California
Louisiana Heart Hospital (Cardiac Rehabilitation),"64030 Louisiana Highway 434 Lacombe, LA 70445",30.332,-89.9296,Louisiana
Lourdes (Mercy Health - Lourdes Cardiac Rehabilitation),"1530 Lone Oak Rd Paducah, KY 42003-7901",37.05046,-88.6473,Kentucky
Lowell General Hospital (Lowell General Cardiac Rehabilitation),"1 Hospital Dr Lowell, MA 01852-1311",42.64578,-71.3012,Massachusetts
Loyola Center for Health At Burr Ridge (Cardiac Rehabilitation),"6800 N. Frontage Road First Floor Burr Ridge, IL 60527",41.75962,-87.9143,Illinois
Lubbock Heart and Surgical Hospital (Lubbock Heart and Surgical Hospital Cardiac Rehabilitation),"4801 N loop 289 Lubbock, TX 79416",33.60327,-101.912,Texas
Lutheran Hospital of Indiana (Cardiopulmonary Rehabilitation (CR)),"7950 West Jefferson Blvd. Fort Wayne, IN 46804",41.03853,-85.2449,Indiana
Lutheran Medical Center (Lutheran Medical Center),"150 55th Street Brooklyn, NY 11220",40.64666,-74.0209,New York
M Health Fairview St. John's Hospital (Fairview St. John's Hospital Heart Care Cardiac Rehabilitation),"1575 Beam Avenue Maplewood, MN 55109",45.02975,-93.0331,Minnesota
Mackinac Straits Health System (Cardiac Rehabilitation),"1140 N State Street Saint Ignace, MI 49781",45.89105,-84.7319,Michigan
MacNeal Hospital (MacNeal Hospital Cardiac Rehabilitation),"3249 S. Oak Park Ave. Berwyn, IL 60402",41.83216,-87.7916,Illinois
Madison County Memorial Hospital (Madison County Health Care System Cardiac Rehab),"300 West Hutchings Street Winterset, IA 50273",41.32832,-94.017,Iowa
Madison Medical Center (Cardiac Rehabilitation),"611 W Main St. Fredericktown, MO 63645",37.55889,-90.3029,Missouri
Madonna ProActive Health & Fitness Center (Life Balance for Heart),"7111 Stephanie Lane Lincoln, NE 68516",40.73973,-96.6479,Nebraska
Magnolia Regional Health Center (Magnolia Regional Health Center Cardiac Rehabilitation),"611 Alcorn Drive Corinth, MS 38834",34.93613,-88.5597,Mississippi
Magruder Hospital (Magruder Hospital Cardiac Rehab),"615 Fulton St Port Clinton, OH 43452-2001",41.49962,-82.9361,Ohio
Maine Medical Center (Turning Point Cardiac Rehabilitation),"22 Bramhall St Portland, ME 04102-3175",43.65272,-70.2767,Maine
MaineGeneral Medical Center (MaineGeneral Medical Center Cardiac Rehabilitation - Waterville),"149 North Street Waterville, ME 04901",44.56521,-69.6464,Maine
MaineGeneral Medical Center - Augusta (MaineGeneral Medical Center Cardiac Rehabilitation - Augusta),"35 Medical Center Pkwy Ste A1211 Augusta, ME 04330",44.36276,-69.7806,Maine
Manchester Memorial Hospital (Manchester Memorial Hospital Cardiac Rehabilitation),"71 Haynes Street Manchester, CT 06040",41.78145,-72.5256,Connecticut
Margaret Mary Health (Margaret Mary Health),"321 Mitchell Avenue Batesville, IN 47006",39.30525,-85.2227,Indiana
Maria Parham Health (Maria Parham Health Cardiac Rehab),"511 Ruin Creek Rd Henderson, NC 27536-5919",36.33135,-78.447,North Carolina
Marietta Memorial Hospital (Marietta Memorial Hospital Cardiac Rehabilitation),"401 Mathew St Marietta, OH 45750",39.43146,-81.4651,Ohio
Mariners Hospital Baptist Health (Mariners Hospital Baptist Health Cardiac Rehabilitation),"91500 Overseas Highway Tavernier, FL 33070",25.00601,-80.5213,Florida
MarinHealth Cardiovascular Medicine (MarinHealth Cardiovascular Medicine Cardiac Rehabilitation),"2 Bon Air Rd Suite 140 Larkspur, CA 94939",37.94341,-122.539,California
Marion General Hospital (Marion Health Cardiovascular Rehabilitation),"330 N. Wabash Ave. Marion, IN 46952",40.56377,-85.6641,Indiana
Marion Regional Health Care System (Cardiac Rehab.),"P.O. Box 1150 Marion, SC 29571-1150",34.17822,-79.4006,South Carolina
Marlborough Hospital (Marlborough Hospital Cardiac Rehab),"157 Union ave Marlborough, MA 01752",42.35538,-71.555,Massachusetts
Marshall Browning Hospital (Marshall Browning Hospital Cardiac Rehabilitation),"900 N Washington St DuQuoin, IL 62832-1233",38.02537,-89.2362,Illinois
Marshall County Healthcare Center (Marshall County Healthcare Center Cardiac Rehab),"413 9th St Britton, SD 57430-2274",45.78856,-97.7461,South Dakota
Marshall Life Center (Cardiac Rehabilitation Program of Christus Good Shepherd Medical Center),"Marshall Life Center 612 South Grove St Marshall, TX 75670",32.538,-94.3704,Texas
Marshall Medical Center (Marshall Medical Intensive Cardiac Rehabilitation),"1000 Fower Way, Suite #3 Placerville, CA 95667",38.72689,-120.793,California
Marshalltown Medical Surgical Center (Cardiac Rehab Marshalltown),"55 Unitypoint Way Marshalltown, IA 50158",42.00198,-92.9145,Iowa
Marshfield Medical Center (Marshfield Medical Center Cardiac Rehab),"611 St. Joseph Avenue Outpatient Cardiopulmonary Rehab Marshfield, WI 54449",44.67048,-90.1808,Wisconsin
Marshfield Medical Center - Dickinson (Marshfield Medical Center - Dickinson Cardiac Rehab),"1721 S. Stephenson Ave. Iron Mountain, MI 49801",45.80984,-88.0445,Michigan
Marshfield Medical Center - Ladysmith (Marshfield Medical Center Cardiac Rehab - Ladysmith),"900 College Ave W Ladysmith, WI 54848-2116",45.45489,-91.1096,Wisconsin
Marshfield Medical Center - Park Falls Hospital (Marshfield Medical Center - Park Falls Hospital Cardiac Rehabilitation),"98 Sherry Avenue Park Falls, WI 54552",45.93106,-90.4413,Wisconsin
Marshfield Medical Center - Weston (Marshfield Medical Center - Weston Cardiac Rehab),"3400 Ministry Pkwy Weston, WI 54476",44.89033,-89.5803,Wisconsin
Marshfield Medical Center Eau Claire (Marshfield Medical Center Eau Claire Cardiac Rehab),"2310 Craig Rd Eau Claire, WI 54701-6128",44.7942,-91.5201,Wisconsin
Marshfield Medical Center-Beaver Dam (Marshfield Medical Center-Beaver Dam Cardiac Rehabilitation),"707 S. University Ave Beaver Dam, WI 53916",43.44979,-88.8252,Wisconsin
Martin Health Systems (Martin Health Systems - Cardiopulminary Rehab),"300 Southeast Hospital Avenue Stuart, FL 34994",27.19807,-80.2434,Florida
Mary Greeley Medical Center (Mary Greeley Medical Center Cardiac Rehab),"1111 Duff Ave Ames, IA 50010",42.0328,-93.6118,Iowa
Mary Lanning Healthcare (Mary Lanning Healthcare Cardiac Rehabilitation),"715 N. St. Joseph Hastings, NE 68901",40.59068,-98.3881,Nebraska
Mary Rutan Hospital Cardiac Rehab Clinic,"205 Palmer Ave. Bellefontaine, OH 43311",40.36864,-83.7572,Ohio
Mary Washington Hospital Cardiopulmonary Health and Fitness (Mary Washington Hospital Cardiac Rehabilitation),"1101 Sam Perry Blvd # B Suite 240, ASC Fredericksburg, VA 22401-4467",38.31006,-77.4837,Virginia
Massena Hospital (Massena Hospital Cardiac Rehabilitation),"1 Hospital Dr Massena Hospital Massena, NY 13662-1056",44.93616,-74.909,New York
Maui Memorial Medical Center (Maui Memorial Medical Center),"221 Mahalani Street Wailuku, HI 96793",20.88521,-156.49,Hawaii
Maury Regional Medical Center (Maury Regional Medical Center Cardiac Rehabilitation),"1224 Trotwood Ave Columbia, TN 38401",35.60675,-87.0671,Tennessee
Mayo Clinic Arizona (Mayo Clinic Arizona Cardiac Rehabilitation),"13400 E Shea Blvd Scottsdale, AZ 85259-5452",33.58583,-111.794,Arizona
Mayo Clinic Arizona (Cardiac Rehabilitation),"13737 N 92nd St Scottsdale, AZ 85260-7434",33.61084,-111.882,Arizona
Mayo Clinic Florida (Mayo Clinic Florida Cardiac Rehab),"4500 San Pablo Road Mayo Building 2 North Jacksonville, FL 32224",30.26279,-81.4415,Florida
Mayo Clinic Health System (Cardiac Rehabilitation),"2004 Pioneer Street Waycross, GA 31501",31.22628,-82.3462,Georgia
Mayo Clinic Health System - Austin (Mayo Clinic Health System - Austin Cardiac Rehabilitation),"1000 First Drive NW Austin, MN 55912",43.67454,-92.9774,Minnesota
Mayo Clinic Health System - Barron (Mayo Clinic Health System - Barron Cardiac Rehabilitation),"1222 E. Woodland Avenue Barron, WI 54812",45.39767,-91.8401,Wisconsin
Mayo Clinic Health System - Eau Claire (Mayo Clinic Health System - Eau Claire Cardiac Rehabilitation),"1221 Whipple St Eau Claire, WI 54703-5270",44.81213,-91.512,Wisconsin
Mayo Clinic Health System - Franciscan Healthcare in Sparta (Mayo Clinic Health System - Sparta Cardiac Rehabilitation),"310 West Main St. Sparta, WI 54656",43.94429,-90.8142,Wisconsin
Mayo Clinic Health System - Osseo (Mayo Clinic Health System Osseo Cardiac Rehabilitation),"13025 8th St PO Box 70 Osseo, WI 54758-7634",44.57218,-91.2274,Wisconsin
Mayo Clinic Health System - Red Wing (Red Wing Cardiac Rehab),"701 Hewitt Blvd Red Wing, MN 55066",44.56,-92.572,Minnesota
Mayo Clinic Health System Bloomer (Mayo Health System Bloomer Cardiac Rehabilitation),"1501 Thompson Street Bloomer, WI 54724",45.10176,-91.5017,Wisconsin
Mayo Clinic Health System In Albert Lea (MCHS-Albert Lea Cardiac Rehab),"404 W Fountain St Albert Lea, MN 56007",43.6525,-93.3731,Minnesota
Mayo Clinic Health System in Mankato (Mayo Clinic Health System Mankato Cardiac Rehabilitation),"1025 Marsh St Mankato, MN 56001-4752",44.1642,-93.9842,Minnesota
Mayo Clinic Health System La Crosse (Mayo Clinic Health System La Crosse Cardiac Rehabilitation),"Cardiopulmonary Rehabilitation 700 West Ave South LaCrosse, WI 54601",43.80436,-91.2427,Wisconsin
Mayo Clinic Health System Menomonie (Mayo Clinic Health System Menomonie Cardiac Rehabilitation),"2321 Stout Road Menomonie, WI 54751",44.88313,-91.9015,Wisconsin
Mayo Clinic Health System New Prague (Mayo Clinic Health System New Prague Cardiac Rehabilitation),"301 2nd St. NE New Prague, MN 56071",44.54625,-93.5745,Minnesota
Mayo Clinic Lake City (Phase II Cardiac Rehab),"Rehabilitation Department 500 W. Grant St. Lake City, MN 55041",44.45898,-92.2865,Minnesota
Mayo Clinic Rochester (Mayo Clinic Rochester Cardiovascular Health Clinic Cardiac Rehabilitation),"200 1st St. SW Rochester, MN 55905",44.02267,-92.4668,Minnesota
McCullough Hyde Memorial Hospital (Cardiac Rehab),"110 N Poplar St Oxford, OH 45056",39.51222,-84.7415,Ohio
McDonough District Hospital (McDonough District Hospital Cardiac Rehabilitation Department),"525 East Grant Street Macomb, IL 61455",40.447,-90.6643,Illinois
McKee Medical Center (Cardiac Rehabilitation Program (Old Program Record)),"2000 Boise Ave Loveland, CO 80538",40.41324,-105.051,Colorado
McKee Medical Center (McKee Medical Center Cardiac Rehabilitation),"2000 N. Boise Ave Suite 120 Loveland, CO 80538",40.41324,-105.051,Colorado
McKenzie Willamette Medical Center (McKenzie Cardiac Rehabilitation),"960 16th St Ste 303 Springfield, OR 97477-4175",44.05376,-123.002,Oregon
McLaren Bay Region (McLaren Bay Region Cardiac Rehab),"3190 E Midland Rd attn: Center for Rehab - Cardiac rehabilitation Bay City, MI 48706-2755",43.59447,-83.8889,Michigan
McLaren Macomb (McLaren Macomb Cardiac Rehabilitation),"1000 Harrington Blvd Mount Clemens, MI 48043",42.58728,-82.8972,Michigan
McLaren Northern Michigan (McLaren Northern Michigan Petoskey Cardiovascular Rehabilitation),"416 Connable Ave Petoskey, MI 49770",45.37328,-84.9699,Michigan
McLaren Northern Michigan Cheboygan (Mclaren Northern Michigan Cheboygan Campus),"740 South Main Cheboygan, MI 49721",45.63157,-84.4829,Michigan
McLaren Oakland (McLaren Oakland Cardiac Rehabilitation),"50 N. Perry St. Pontiac, MI 48342",42.63853,-83.2908,Michigan
McLead Regional Medical Center (McLead Regional Medical Center Cardiac Rehab),"2437 Willwood Drive Florence, SC 29501",34.18628,-79.8197,South Carolina
McLeod Health (McLeod Cardiac Rehab),"2437 Willwood Drive Florence, SC 29501",34.1864372238536,-79.8197048326466,South Carolina
McLeod Health Clarendon (McLeod Health Clarendon Cardiac Rehabilitation),"10 Hospital Street Manning, SC 29102",33.68695,-80.2111,South Carolina
McLeod Loris (McLeod Loris Cardiac Rehab),"3655 Mitchell Street Loris, SC 29569",34.05701,-78.8987,South Carolina
McLeod Seacoast Hospital (McLeod Seacoast Hospital Cardiac Rehabilitation),"4000 Highway 9 E Little River, SC 29566-7833",33.86558,-78.6635,South Carolina
Meadowlands Hospital Medical Center (Life Span Cardiac Rehabilitation Program),"55 Meadowlands Parkway Secaucus, NJ",40.79174,-74.0734,New Jersey
Meadowview Regional Medical Center (Meadowview Regional Medical Center Cardiac Rehabilitation),"989 Medical Park Suite 301 Maysville, KY 41056",38.64037,-83.8084,Kentucky
Mease Countryside Hospital (Mease Countryside Cardiac Rehab),"1840 Mease Dr Medical Arts Bldg Suite 105 Safety Harbor, FL 34695-6600",28.03853,-82.7064,Florida
Medical Center Arlington (Medical City Arlington Cardiac Rehab),"515 W Mayfield Rd Ste 118 Arlington, TX 76014-2084",32.69145,-97.1131,Texas
Medical Center Hospital (Ann Roden Deaderick Cardiac Rehabilitation),"8050 E Highway 191 Ste 107 Odessa, TX 79765-8613",31.92172,-102.289,Texas
Medical Center of South Arkansas (Cardiac Rehabilitation Services),"700 West Grove St. El Dorado, AR 71730",33.22155,-92.671,Arkansas
Medical Center of the Rockies (Medical Center of the Rockies Cardiac Rehabilitation),"2500 Rocky Mountain Avenue South Medical Office Bldg., Suite 170 Loveland, CO 80538",40.4156,-104.997,Colorado
Medical City Dallas Hospital (Medical City Dallas Hospital Cardiac Rehabilitation),"7777 Forest Lane C-240 Dallas, TX 75230",32.91177,-96.7724,Texas
Medical City Heart and Spine (Medical City Heart and Spine Cardiac Rehab),"11970 N Central Expy Dallas, TX 75243-3768",32.91204,-96.7667,Texas
Medical City Lewisville (Medical City Lewisville Cardiac Rehabilitation Program),"Medical City Lewisville 500 W. Main Street Lewisville, TX 75057",33.04542,-97.005,Texas
Medical City Plano (Medical City Plano Cardiac Rehabilitation),"3901 W 15th St Bldg 122 Plano, TX 75075-7738",33.02124,-96.7661,Texas
Medical University Hospital Authority (Medical University Hospital Authority Cardiac Rehabilitation Program),"169 Ashley Ave Charleston, SC 29425-8905",32.78435,-79.9468,South Carolina
Medical University of South Carolina (Medical University of South Carolina Cardiac Rehabilitation),"122 Bee St., Suite 201 MSC 202 Charleston, SC 29425",32.7861,-79.953,South Carolina
Medical University of South Carolina (MUSC) (MUSC Health Florence Medical Center Cardiac Rehabilitation),"805 Pamplico Hwy Suite B110 Florence, SC 29501-0550",34.1601,-79.752,South Carolina
MedStar Franklin Square Medical Center (Medstar Franklin Square Cardiac Rehabilitation),"9105 Franklin Square Drive suite 106 Baltimore, MD 21237",39.35054,-76.4767,Maryland
MedStar Good Samaritan Hospital/Good Health Center (MedStar Good Samaritan Hospital/Good Health Center Phase II Cardiac Rehabilitation),"5601 Loch Raven Blvd O'Neill Building 2nd Floor Baltimore, MD 21239",39.35821,-76.5873,Maryland
Medstar Montgomery Medical Center (MedStar Montgomery Medical Center Cardiac Rehabilitation),"18101 Prince Philip Dr Room 2082 Olney, MD 20832-1514",39.15406,-77.0547,Maryland
Medstar Southern Maryland Hospital Center (MedStar Southern Maryland Cardiac Rehabilitation),"7503 Surratts Rd Clinton, MD 20735-3358",38.74821,-76.8759,Maryland
Medstar Union Memorial Hospital (MedStar Union Memorial Hospital Cardiac Rehabilitation),"201 East University Parkway Cardiac Rehab Dept. Baltimore, MD 21218",39.3296,-76.6143,Maryland
Medstar Washington Hospital Center (Medstar Washington Hospital Center Cardiac Rehab and Wellness Programs),"110 Irving Street, NW BB 43 Washington, DC 20010",38.9295,-77.0162,Washington DC
"MedStar, St. Mary's Hospital (Grace Anne Dorney Cardiac Rehabilitation)","25500 Point Lookout Rd PO Box 527 Leonardtown, MD 20650",38.3021,-76.6382,Maryland
Meeker Memorial Hospital (Meeker Memorial Hospital and Clinics Cardiac Rehabilitation),"612 South Sibley Ave Litchfield, MN 55355",45.11961,-94.5291,Minnesota
Melrose-Wakefield Hospital (Melrose-Wakefield Cardiac Rehabilitation),"Hallmark Health 585 Lebanon Street Melrose, MA 02176",42.46062,-71.0617,Massachusetts
Memorial Health Care Systems (Memorial Health Care Cardiac Rehab),"300 N Columbia Ave Seward, NE 68434-2228",40.90935,-97.0919,Nebraska
Memorial Healthcare (Cardiac Rehab),"826 W. King St. Owosso, MI 48867",43.00547,-84.1795,Michigan
Memorial Hermann Greater Heights (Memorial Hermann Greater Heights Cardiac Rehab),"1635 North Loop W 1st Floor, South Tower Houston, TX 77008-1532",29.81154,-95.4304,Texas
Memorial Hermann Hospital Heart and Vascular Institute (Memorial Hermann Cardiac Rehabilitation),"6414 Fannin Street, Ste G 100 Houston, TX 77030",29.71386,-95.3979,Texas
Memorial Hermann Memorial City (Memorial Hermann Memorial City Cardiac Rehab),"915 Gessner Suite 420 Houston, TX 77024",29.78022,-95.5451,Texas
Memorial Hermann Southeast Hospital (Cardiac Rehab),"11800 Astoria Blvd Houston, TX 77089",29.58225,-95.2079,Texas
Memorial Hermann Southwest Heart & Vascular Institute (Memorial Hermann Southwest Heart & Vascular Institute Cardiac Rehabilitation),"7600 Beechnut 1st Floor Pavilion Houston, TX 77084",29.69332,-95.5224,Texas
Memorial Hermann The Woodlands (Memorial Hermann The Woodlands Cardiac Rehab),"9180 Pinecroft Dr. Suite 130 The Woodlands, TX 77380",30.17548,-95.4555,Texas
Memorial Hospital (Memorial Hospital Cardiac Rehabilitation),"4500 Memorial Drive Belleville, IL 62226",38.54995,-90.0215,Illinois
Memorial Hospital (Memorial Hospital Cardiac Rehabilitation),"3073 White Mountain Highway PO Box 5001 North Conway, NH 03860",44.06128,-71.1369,New Hampshire
Memorial Hospital (Memorial Hospital Cardiac Rehabilitation),"175 S. Union Blvd, Suite 230 Colorado Springs, CO 80910",38.82973,-104.793,Colorado
Memorial Hospital and Health Care Center (Memorial Hospital and Healthcare Center Cardiac Rehabilitation),"800 W 9th St Jasper, IN 47546-2514",38.39598,-86.9401,Indiana
Memorial Hospital at Gulfport (Memorial Hospital at Gulfport Cardiac Rehabilitation),"PO Box 1810 4500 13th St, Gulfport, MS 39502-1810",30.36726,-89.1153,Mississippi
Memorial Hospital of Lafayette County (Memorial Hospital of Lafayette County Cardiac Rehabilitation),"800 Clay St. Darlington, WI 53530",42.68395,-90.11,Wisconsin
Memorial Hospital of Rhode Island (Program for Cardiac Rehabilitation and Prevention),"111 Brewster Street Pawtucket, RI 02860",41.87062,-71.3754,Rhode Island
Memorial Hospital of South Bend (Memorial Hospital of South Bend Cardiac Rehab),"621 Memorial Dr South Bend, IN 46601-1063",41.6838,-86.2532,Indiana
Memorial Hospital of Sweetwater County (Cardiac Rehabilitation),"1200 College Drive Rock Springs, WY 82901",41.58462,-109.235,Wyoming
Memorial Hospital of Union County (Memorial Hospital of Union County Cardiac Rehab),"500 London Avenue Marysville, OH 43040",40.23068,-83.369,Ohio
Memorial Hospital West (Memorial Hospital West Cardiac Rehab),"703 N Flamingo Rd. Pembroke Pines, FL 33028",26.01337,-80.312,Florida
Memorial Medical Center (Memorial Medical Center Cardiac Rehabilitation),"3136 Old Jacksonville Rd Springfield, IL 62704",39.78507,-89.7147,Illinois
Memorial Medical Center (Memorial Medical Center Cardiac Rehabilitaiton),"1615 Maple Lane Ashland, WI 54806",46.56866,-90.8883,Wisconsin
Memorial Medical Center (Cardiac Rehabilitation),"2450 S Telshor Blvd Las Cruces, NM 88011-5069",32.29204,-106.736,New Mexico
Memorial North Park Hospital (Cardiopulmonary Rehabilitation and Prevention),"2051 Hamill Road Hixson, TN 37343",35.12524,-85.2377,Tennessee
Memorial Regional Hospital (Memorial Regional Hospital Cardiac Rehab),"300 Hollywood Way Hollywood, FL 33021",26.01283,-80.1736,Florida
Memorial University Medical Center (Memorial Health Cardiac Rehabilitation),"4700 Waters Avenue Savannah, GA 31404",32.03069,-81.0882,Georgia
Menorah Medical Center (Cardio-Pulmonary Rehabilitation),"5721 West 119th Street Overland Park, KS 66209",38.91049,-94.6516,Kansas
Mercer Health (Mercer Health Cardiac Rehab),"800 West Main Street Coldwater, OH 45828",40.48063,-84.6392,Ohio
Mercy - Berryville (Mercy - Berryville Cardiovascular Rehabilitation),"214 Carter Street Berryville, AR 72616",36.35897,-93.5517,Arkansas
Mercy Ambulatory Care Center (Cardiac Rehabilitation),"3669 Southwestern Blvd Orchard Park, NY 14127",42.78045,-78.7726,New York
Mercy Fitzgerald Hospital (Outpatient Cardiac Rehab),"1503 Lansdowne Ave Mail Stop #113 Darby, PA 19023",39.92795,-75.2679,Pennsylvania
Mercy General Hospital (Mercy General Hospital Cardiac Rehabilitation),"4001 J Street Sacramento, CA 95819",38.57043,-121.453,California
Mercy Hammons Heart Institute (Mercy Springfield Cardiac Rehab),"Hammons Heart Institute 1235 E. Cherokee Springfield, MO 65804",37.17992,-93.2762,Missouri
Mercy Harvard Hospital (Mercyhealth Cardiac Rehabilitation - Harvard),"901 Grant St. Harvard, IL 60033",42.42634,-88.607,Illinois
Mercy Health - Fairfield Hospital (Mercy Health - Fairfield Hospital Cardiac Rehabilitation),"3000 Mack Rd Cardiopulmonary Rehab Fairfield, OH 45014",39.31268,-84.5179,Ohio
Mercy Health Anderson (Bon Secours Mercy Health Anderson Cardiac Rehabilitation),"7495 State Road Suite 100 Cincinnati, OH 45255",39.08108,-84.3499,Ohio
Mercy Health Clermont (Mercy Health Clermont Cardiac Rehabilitation Program),"2055 Hospital Drive Suite 120 Batavia, OH 45103-1978",39.08029,-84.1444,Ohio
Mercy Health Muskegon Heart Center (Mercy Heart Center Cardiac Rehabilitation),"1212 E Sherman Blvd Muskegon, MI 49444-1879",43.20551,-86.2139,Michigan
Mercy Health Saint Mary's (Mercy Health Saint Mary's Cardiac Rehabilitation),"310 Lafayette Ave SE Ste 305 Grand Rapids, MI 49503-4693",42.95774,-85.6614,Michigan
Mercy Health System (Mercyhealth Cardiac Rehab - Janesville),"1010 North Washington Street Janesville, WI 53548",42.69455,-89.0354,Wisconsin
Mercy Hospital (Mercy Hospital Cardiac Rehabilitation),"851 E. Fifth St. STE. 160 Washington, MO 63090",38.55259,-91.0021,Missouri
Mercy Hospital - Aurora (Mercy Hospital - Aurora Cardiac Rehabilitation Aurora),"500 South Porter Ave. Aurora, MO 65605",36.95956,-93.712,Missouri
