Shannon Medical Center (Shannon Medical Center Cardiac Rehabilitation),"102 North Magdalen Suite #140 San Angelo, TX 76903",31.46701,-100.433,Texas
Sharon Regional Health System (Cardiac Rehabilitation),"740 East State Street Sharon, PA 16146",41.23246,-80.4957,Pennsylvania
Sharp Chula Vista Medical Center (Sharp Chula Vista Medical Center Cardiac Rehabilitation),"751 Medical Center Court Chula Vista, CA 91911",32.61965,-117.023,California
Sharp Grossmont Hospital (Sharp Grossmont Hospital Cardiac Rehab),"5555 Grossmont Center Dr PO Box 158 La Mesa, CA 91942",32.78157,-117.007,California
Sharp Memorial Hospital (Sharp Memorial Hospital Cardiac Program),"7901 Frost St San Diego, CA 92123-2701",32.79952,-117.155,California
Shasta Regional Medical Center (Shasta Regional Medical Center),"1355 East St Redding, CA 96001",40.58638,-122.388,California
Shenandoah Medical Center (Shenandoah Medical Center Cardiac Rehabilitation),"300 Pershing Ave Shenandoah, IA 51601",40.75275,-95.3693,Iowa
Sheridian Memorial Hospital (Cardiac Rehabilitation),"1401 W 5th Street Sheridan, WY 82801",44.80866,-106.976,Wyoming
Sherman Hospital (Cardiac Rehabilitation),"1019 East Chicago Street Elgin, IL 60120",42.03168,-88.2527,Illinois
Shore Medical Center (Shore Medical Center Cardiac Rehabilitation),"710 Center St Somers Point, NJ 08244-1802",39.31462,-74.5956,New Jersey
Shore Memorial Hospital (Cardiac Rehabilitation),"1 East New York Avenue Somers Point, NJ 8244",39.31478,-74.5941,New Jersey
Sidney Regional Medical Center (Sidney Regional Medical Center Cardiac Rehab),"1000 Pole Creek Crossing Sidney, NE 69162-2901",41.1361,-102.952,Nebraska
Sierra - Providence Physical Rehabilitation Hospital (Cardiac Rehabilitation Program),"1740 Curie El Paso, TX",31.7788237,-106.4772147,Texas
Sierra Nevada Memorial Hospital (Cardiac Rehabilitation),"155 Glasson Way Grass Valley, CA 95945",39.2278824,-121.0459398,California
Sierra Vista Regional Health Center (Cardiopulmonary Rehab),"300 El Camino Real Sierra Vista, AZ 85635",31.5517126,-110.27026,Arizona
Signature Healthcare Brockton Hospital (Cardiac Rehabilitation),"680 Centre St Brockton, MA 02302",42.0877929,-70.9913654,Massachusetts
Siloam Springs Memorial Hospital (Cardiopulmonary Rehabilitation),"205 E Jefferson Siloam Springs, AR 72761",36.1818489,-94.5404043,Arkansas
Silver Cross Hospital (Silver Cross Hospital Cardiac Rehabilitation),"1200 Maple Road Joliet, IL 60432",41.535333,-88.051039,Illinois
Singing River Health System/ Ocean Springs Hospital (Singing River Health System/ Ocean Springs Hospital Cardiac Rehabilitation),"1175 Ocean Springs Rd Ocean Springs, MS 39564",30.414377,-88.7794184,Mississippi
Singing River Health System/ Singing River Hospital (Singing River Health System/ Singing River Hospital Cardiac Rehabilitation),"3101 Denny Ave Suite 130 Pascagoula, MS 39581",30.3770285,-88.5301647,Mississippi
Sioux Center Community Hopsital & Health Center (Cardiopulmonary Rehabilitation),"38 19th St SW Sioux Center, IA 51250",43.0580238,-96.1764395,Iowa
Sisters of Charity at St. Joseph Campus (Sisters of Charity Hospital St. Joseph Campus Cardiac Rehabilitation),"2605 Harlem Rd Buffalo, NY 14225-4018",42.9143415,-78.7823226,New York
Sistersville General Hospital (Cardiac Rehabilitation Progam),"314 South Wells St. Sistersville, WV 26175",39.5586939,-81.0041568,West Virginia
Sky Ridge Medical Center (Sky Ridge Medical Center Cardiac Rehab),"10101 Ridgegate Pkwy Lone Tree, CO 80124-5522",39.5297665,-104.8716442,Colorado
Sleepy Eye Medical Center (Sleepy Eye Medical Center Cardiac Rehabilitation),"400 4th Avenue NW Sleepy Eye, MN 56085",44.2995058,-94.7284803,Minnesota
Slidell Memorial Hospital (Slidell Memorial),"1001 Gause Blvd. Slidell, LA 70458",30.2836667,-89.7701541,Louisiana
Smyth County Community Hospital (Smyth County Community Hospital Cardiac Rehab),"245 Medical Park Drive Marion, VA 24354",36.8519149,-81.4882239,Virginia
Soldiers and Sailors Memorial Hospital (Soldiers & Sailors Memorial Hospital Cardiac Rehabilitation),"418 N. Main Street Penn Yan, NY 14527",42.6706422,-77.0610591,New York
South Arkansas Cardiac Rehab (The Professional Building) (South Arkansas Cardiac Rehab),"1010 N Dudney Rd Ste E Magnolia, AR 71753-2651",33.2755161,-93.2306081,Arkansas
South Arkansas Cardiac Rehab Pine Bluff (LDC Cardiac Rehab),"7200 S Hazel St Pine Bluff, AR 71603-7836",34.1514223,-92.0250851,Arkansas
South Baldwin Regional Medical Center (South Baldwin Regional Medical Center Cardiac Rehabilitation),"1613 N. McKenzie Street Foley, AL 36526",30.4257603,-87.6843081,Alabama
South Central Regional Medical Center (South Central Regional Medical Center Cardiac Rehabilitation),"PO Box 607 Laurel, MS 39441",31.6944561,-89.1406904,Minnesota
"South Denver Cardiology Associates, P.C., South Denver Heart Center (South Denver Cardiac Rehabilitation Clinic)","1000 SouthPark Drive Littleton, CO 80120",39.5669208,-105.0006764,Colorado
South Florida Baptist Hospital (South Florida Baptist Hospital Cardiac Rehab),"301 N Alexander St Plant City, FL 33563-4303",28.0154998,-82.1388933,Florida
South Georgia Medical Center (South Georgia Medical Cardiac Rehabilitation Center),"201 Pendleton Drive Suite 270 Valdosta, GA 31602",30.8640382,-83.2869504,Georgia
South Nassau Communities Hospital (Center for Cardiac Rehabiliation),"440 Merrick Road Oceanside, NY",40.6532926,-73.624811,New York
South Shore Hospital (South Shore Hospital Cardiac Rehabilitation),"55 Fogg Road South Weymouth, MA 02190",42.1758242,-70.9541227,Massachusetts
South Texas Health System - McAllen (South Texas Health System Heart Intensive Cardiac Rehab),"500 E Ridge Rd Ste 200 McAllen, TX 78503",26.184519,-98.2180084,Texas
Southeast Alabama Medical Center (Southeast Health Cardiac and Pulmonary Rehabilitation),"1108 Ross Clark Circle P.O. Box 6987 Dothan, AL 36302-6987",31.2164043,-85.3636361,Alabama
Southeast Georgia Health System - Brunswick Campus (The John Jackson Hart - Cardiac Rehabilitation Unit),"2415 Parkwood Dr Brunswick, GA 31520-4722",31.1748322,-81.4843639,Georgia
Southeast Health (Southeast Health Cardiac Rehabilitation),"1701 Lacey Street Cape Girardeau, MO 63701",37.3108514,-89.5395907,Missouri
Southeast Iowa Regional Medical Center (Southeast Iowa Regional Medical Center Cardiac Rehab),"1221 S Gear Ave West Burlington, IA 52655",40.8094702,-91.1741496,Iowa
Southeast Louisiana Veterans Health Care System (Southeast Louisiana Veterans Health Care System Cardiac Rehab),"2400 Canal St New Orleans, LA 70119-6535",29.9631872,-90.0848148,Louisiana
Southeastern Ohio Regional Medical Center (Southeastern Ohio Regional Medical Center Cardiac Rehabilitation),"1341 Clark Street Cambridge, OH 43725",40.0413148,-81.577294,Ohio
Southern Illinois Healthcare - Herrin (Southern Illinois Healthcare - Herrin Cardiovascular Pulmonary Rehab),"201 S. 14th Street Herrin, IL 62948",37.8012766,-89.0261475,Illinois
Southern Maine Health Care (SMHC Sanford Cardiac Rehab),"25 June Street Sanford, ME 04073",43.4482284,-70.7680784,Maine
Southern Maine Health Care | Biddeford Campus (SMHC Biddeford Cardiac Rehabilitation),"1 Medical Center Drive Biddeford, ME 04005",43.477416,-70.4906826,Maine
Southern New Hampshire Medical Center (Southern NH Medical Center Cardiac Rehabilitation),"SNHMC West Campus 29 Northwest Blvd Nashua, NH 03063",42.8000287,-71.5459815,New Hampshire
Southern Ocean Medical Center (Southern Ocean Medical Center Cardiac Rehabilitation),"1140 Route 72 West Manahawkin, NJ 08050",39.7215829,-74.285404,New Jersey
Southern Ohio Medical Center (Southern Ohio Medical Center Cardiac Rehabilitation),"Cardiac Rehabilitation 1202 18th Street Portsmouth, OH 45662",38.7454856,-82.987698,Ohio
Southern Regional Medical Center (Southern Regional Medical Center Cardiac Rehabilitation),"11 Upper Riverdale Road SW Riverdale, GA 30274-2615",33.5792393,-84.3898906,Georgia
Southern TN Regional Health System-Lawrenceburg (Southern TN Regional Health System-Lawrenceburg Cardiac Rehab),"1607 S Locust Ave Lawrenceburg, TN 38464-4011",35.2224345,-87.3379455,Tennessee
Southern TN Regional Health System-Pulaski (Southern TN Regional Health System-Pulaski Cardiac Rehab),"1265 E College St Pulaski, TN 38478-4541",35.1916285,-87.0061934,Tennessee
Southlake Rehab (Cardiac Rehabilitation),"1516 N. Main Street Crown Point, IN 46307",41.4379444,-87.3634604,Indiana
Southside Hospital Northwell Health (South Shore University Hospital Northwell Cardiac Rehab),"301 E Main St Bay Shore, NY 11706-8408",40.725875,-73.241786,New York
Southside Regional Medical Center (Southside Regional Medical Center Cardiac Rehab),"430 Claremont Ct Colonial Heights, VA 23834",37.2677188,-77.4002174,Virginia
Southwest Cardiovascular Intervention Clinic (Exercise And Cardiac Rehabilitation Clinic),"1508 N Zaragoza Rd Ste A El Paso, TX 79936-8039",31.739657,-106.289901,Texas
Southwest General Health Center (Southwest General Health Center - Cardiac Rehabilitation),"18697 Bagley Road Middleburg Heights, OH 44130",41.370727,-81.8319943,Ohio
Southwest General Health Center/Strongsville (Southwest General Health Center Cardiac Rehabilitation/Strongville),"18181 Pearl Road Strongsville, OH 44136",41.2870678,-81.8328908,Ohio
Southwest Health (Southwest Health Cardiac Rehab Program),"1400 Eastside Rd Platteville, WI 53818-9800",42.7198321,-90.4581977,Wisconsin
Southwest Memorial Hospital (Cardiac Rehab),"1311 N Mildred Rd Cortez, CO 81321-2231",37.3621911,-108.5744372,Colorado
Southwest Mississippi Regional Medical Center (Cardiac Rehabilitation),"Southwest Center for Rehab 303 Marion Avenue McComb, MS 39648",31.2504864,-90.4737995,Mississippi
Southwestern Vermont Medical Center (Southwestern Vermont Medical Center Cardiac Rehabilitation),"100 Hospital Dr Bennington, VT 05201",42.8738397,-73.2079716,Vermont
Sovah Health-Martinsville (Sovah Health-Martinsville Cardiac Rehabilitation),"320 Hospital Dr CR Department Martinsville, VA 24112-1900",36.7000206,-79.8670343,Virginia
Sparrow Hospital (Sparrow Hospital Cardiac Rehabilitation),"1200 East Michigan Avenue, PO Box 30480 Lansing, MI 48909-7980",42.7331775,-84.5341536,Michigan
Spartanburg Regional Medical Center (Spartanburg Regional Medical Center Heart Wellness Program Cardiac Rehab),"299 East Pearl Street Spartanburg, SC 29303",34.9658726,-81.9344086,South Carolina
Speare Memorial Hospital (Speare Memorial Hospital Cardiac Rehab),"16 Hospital Road Plymouth, NH 03264",43.7577522,-71.6951638,New Hampshire
Spectrum Health Big Rapids Hospital (Spectrum Health Big Rapids Cardiac Rehabilitation),"605 Oak St Big Rapids, MI 49307",43.6938769,-85.4751018,Michigan
Spectrum Health Gerber Memorial (Spectrum Health Gerber Memorial Cardiac Rehab),"212 S Sullivan Ave Fremont, MI 49412-1548",43.4647642,-85.9514583,Michigan
Spectrum Health Grand Rapids (Spectrum Health Grand Rapids Cardiac Rehab),"2902 Bradford Street NE Grand Rapids, MI 49525",42.9765908,-85.5984319,Michigan
Spectrum Health Ludington Hospital (Spectrum Health Ludington Hospital Cardiac Rehab),"1 Atkinson Dr Ludington, MI 49431-1906",43.9584722,-86.4314628,Michigan
Spectrum Health United Hospital (Spectrum Health United Hospital Cardiac Rehabilitation),"615 S Bower St MC400 Greenville, MI 48838-2614",43.174682,-85.2694986,Michigan
Spencer Hospital (Spencer Hospital Cardiac Rehabilitation),"1200 1st Avenue East Spencer, IA 51301",43.149637,-95.1433697,Iowa
Springfield Hospital (Springfield Hospital Cardiac Rehabilitation),"190 W. Sproul Rd. Pavilion I Springfield, PA 19064",39.9226493,-75.3505095,Pennsylvania
Springfield Regional Medical Center (Cardiac Rehabilitation Program),"2615 East High Street Springfield, OH 45505",39.9189796,-83.769602,Ohio
Springfield Regional Medical Center (Springfield Regional Medical Cardiac Rehabilitation),"100 Medical Center Drive Springfield, OH 45504",39.9286179,-83.816308,Ohio
Springhill Medical Center (Springhill Medical Center Cardiac Rehab),"3719 Dauphin St Mobile, AL 36608-1753",30.6850925,-88.131629,Alabama
SSM DePaul Hospital (SSM DePaul Hospital Cardiac Rehab),"12303 De Paul Dr Bridgeton, MO 63044-2512",38.7502554,-90.4341088,Missouri
SSM Health SJSC (SSM Health SJSC Cardiac Rehab),"300 1st Capitol Dr Saint Charles, MO 63301-2844",38.7799192,-90.4832866,Missouri
SSM Health St. Joseph LSL (SSM Health St. Joseph LSL Cardiac Rehab),"100 Medical Plz Lake Saint Louis, MO 63367-1366",38.802799,-90.7754904,Missouri
SSM St. Mary's Health Center (Cardiac Rehabilitation),"6420 Clayton Rd. St. Louis, MO 63117",38.6330715,-90.311181,Missouri
St David's Medical Center (St. David's Medical Center Cardiac Rehabilitation),"900 East 30th St Suite 314 Austin, TX 78705",30.2888381,-97.7250689,Texas
St Francis Hospital and Medical Center (Saint Francis Hospital & Medical Center Cardiac Rehabilitation),"Hoffman Heart, Saint Francis Hospital 114 Woodland St Hartford, CT 06105",41.7736144,-72.6986631,Connecticut
St Iver's (Cardiac Rehab Program),"743 Evergreen Terrace Neptune, CA 90909",36.778261,-119.4179324,California
St Joseph Hospital (St. Joseph Hospital Cardiac Rehabilitation),"172 Kinsley Street Nashua, NH 03061-2013",42.7490847,-71.4803044,New Hampshire
St Joseph Rehabilitation Center (CHI St Joseph Health Cardiac Rehabilitation),"1600 Joseph Dr Bryan, TX 77802",30.6602581,-96.3508996,Texas
St Joseph's Hospital and Medical Center (St Joseph's Hospital and Medical Center Cardiac Rehabilitation),"Cardiac/Pulmonary Rehabilitation 350 W. Thomas Rd Phoenix, AZ 85013",33.4819546,-112.0798085,Arizona
"St Marys Good Samaritan, Inc. (Cardiac Rehab)","SSM Health Good Samaritan Hospital 2 Good Samaritan way Mt. Vernon, IL 62864",38.2965165,-88.9394387,Illinois
St. Alphonsus Medical Center- Nampa (Cardiac Rehabilitation),"1512 12th Avenue Road Nampa, ID 83686",43.5538707,-116.5705814,Idaho
St. Alphonsus Regional Medical Center (St. Alphonsus Regional Medical Center Cardiac Rehab),"900 N Liberty St Ste 302 Boise, ID 83704",43.6132359,-116.2589969,Idaho
St. Anne Hospital (St. Anne Hospital Cardiac Rehab),"16251 Sylvester Rd SW 3 Cedar Gym Ms: 95-67 Burien, WA 98166-3017",47.457487,-122.343248,Washington
St. Anthony Hospital (St. Anthony Hospital Cardiac Rehabilitation),"11600 W 2nd Pl, Lakewood, CO 80228",39.7160026,-105.1292761,Colorado
St. Anthony North Hospital (St. Anthony North Health Campus Cardiac Rehab),"14300 Orchard Pkwy Westminster, CO 80023",39.9554628,-104.9915514,Colorado
St. Anthony Regional Hospital (St. Anthony Regional Hospital Cardiac Rehab),"311 South Clark St. Carroll, IA 51401",42.0557208,-94.8657176,Iowa
St. Anthony's Hospital (St. Anthony's Hospital Cardiac Rehabilitation),"1201 5th Ave N Ste 103 Saint Petersburg, FL 33705",27.7778975,-82.6511085,Florida
St. Anthony's Memorial Hospital (Cardiac Rehabilitation),"503 N Maple St Effingham, IL 62401-2006",39.1257145,-88.5503386,Illinois
St. Bernard Parish Hospital (St. Bernard Outpatient Cardiac Rehab),"8000 W Judge Perez Dr Chalmette, LA 70043-1668",29.9549008,-89.9886329,Louisiana
St. Catherine Hospital (St. Catherine Hospital Cardiac Rehabilitation),"4321 Fir Street East Chicago, IN 46312",41.6349065,-87.4483141,Indiana
St. Catherine Hospital (St. Catherine Hospital Cardiac Rehab),"401 E Spruce St Garden City, KS 67846",37.9696779,-100.8683424,Kansas
St. Charles Hospital (St. Charles Cardiac Rehabilitation),"200 Belle Terre Rd Port Jefferson, NY 11777-1928",40.9467577,-73.0603108,New York
St. Charles Medical Center (St. Charles Medical Center Cardiac Rehabilitation),"2500 NE Neff Road Bend, OR 97701",44.0678387,-121.269385,Oregon
St. Charles Parish Hospital (St. Charles Parish Hospital Cardiac Rehabilitation),"1057 Paul Maillard Rd Luling, LA 70070-4349",29.924114,-90.3704954,Louisiana
St. Clair Hospital (St. Clair Hospital Cardiac Rehabilitation),"1000 Bower Hill Rd Cardiac/ Pulmonary Rehab Department Pittsburgh, PA 15243-1873",40.3780993,-80.0666096,Pennsylvania
St. Claire Regional Medical Center (Fresh Start Cardiac Rehabilitation),"222 Medical Circle Drive Morehead, KY 40351",38.1528496,-83.5034994,Kentucky
St. Clare Health Center (SSM St. Clare Cardiac Rehabilitation),"1015 Bowles Ave Fenton, MO 63026",38.5274113,-90.4762222,Missouri
St. Clare Hospital (St. Clare Hospital Cardiovascular Rehabilitation),"707 14th St Baraboo, WI 53913-1539",43.4811645,-89.7302197,Wisconsin
St. Clare Hospital Wisconsin Dells (St. Clare Wisconsin Dells Cardiac Rehab),"1302 Broadway Wisconsin Dells, WI 53965-1358",43.6274794,-89.7709579,Wisconsin
St. Clare Memorial Hospital (Cardiac Rehabilitation),"855 South Main Street Oconto Falls, WI 54154",44.8652395,-88.1278362,Wisconsin
St. Clare's Hospital (Saint Clares Hospital Cardiac Rehab),"25 Pocono Rd St. Clare's Cardiac Rehabilitation Dept. Denville, NJ 07834",40.8946151,-74.4650723,New Jersey
St. Croix Regional Medical Center (St Croix Regional Medical Center Cardiac Rehabilitation),"235 State Street Saint Croix Falls, WI 54024",45.4088784,-92.642817,Wisconsin
St. Davids Georgetown Hospital (St. Davids Georgetown Hospital Cardiac Rehab),"2000 Scenic Dr Georgetown, TX 78626",30.6260972,-97.6893849,Texas
St. Davids Round Rock Medical Center (St. David's Round Rock Cardiac Rehabilitation),"2300 Round Rock Avenue MOB Suite 104 Round Rock, TX 78681",30.5104905,-97.7140137,Texas
St. David's South Austin Medical Center (St. David's South Austin Medical Center Cardiac Rehab),"621 Radam Ln Ste 200 Austin, TX 78745",30.2251053,-97.7734635,Texas
St. Dominic Jackson-Memorial Hospital (St. Dominic Jackson-Memorial Hospital Cardiac Rehabilitation),"969 Lakeland Drive East Tower Suite 310 Jackson, MS 39216",32.3364828,-90.1636614,Mississippi
St. Elizabeth Healthcare (St. Elizabeth Cardiac Rehab- Edgewood),"711 Medical Village Dr Edgewood, KY 41017-3439",39.0099004,-84.5652726,Kentucky
St. Elizabeth Healthcare (St. Elizabeth Cardiac Rehab- Ft. Thomas),"85 North Grand Ave. Ft. Thomas, KY 41075",39.0780997,-84.4667902,Kentucky
St. Elizabeth Healthcare - Dearborn (St. Elizabeth Healthcare Dearborn - Cardiac Rehab),"600 Wilson Creek Rd Outpatient Cardiac Rehab Dept. Lawrenceburg, IN 47025",39.1112254,-84.8837548,Indiana
St. Elizabeth Hospital (Ascension NE Wisconsin St. Elizabeth Hospital Cardiac Rehabilitation),"1506 S. Oneida Street Appleton, WI 54915",44.2485076,-88.4027388,Wisconsin
St. Elizabeth Medical Center Bernard D Kosowsky Cardiovascular Rehabilitation & Prevention Center (Bernard D Kosowsky Cardiovascular Rehabilitation & Prevention Center),"280 Washington St. Brighton, MA 02135-2907",42.348129,-71.1501943,Massachusetts
St. Elizabeth's Hospital (Cardiopulmonary Rehabilitation),"211 S. Third St. Belleville, IL 62220",38.5108609,-89.9891536,Illinois
St. Elizebeths Health (Cardiac Rehabilitation),"1710 Lafayette Rd Crawfordsville, IN 47933",40.0663064,-86.9056642,Indiana
St. Francis Community Health Center (St. Francis Cardiac Rehabilitation),"2600 Tower Drive Room 205 Monroe, LA 71201",32.5292283,-92.0976292,Louisiana
St. Francis Health (St. Francis-Emory Healthcare Cardiac Rehabilitation),"2000 16th Avenue Bldg 4 Columbus, GA 31901",32.4825718,-84.9681062,Georgia
St. Francis Hospital (St. Francis Hospital Cardiac Rehabilitation),"1215 Franciscan Drive Litchfield, IL 62056",39.1811987,-89.6390656,Illinois
St. Francis Hospital (Cardiac Rehabilitation),"701 N. Clayton St. 4th Floor Suite 430 Wilmington, DE 19805",39.7503027,-75.5671506,Delaware
St. Francis Hospital (St. Francis Hospital Cardiac Rehab),"34503 9th Ave S St. Francis Hospital Medical Office Building Ste 208 Federal Way, WA 98003",47.2923799,-122.3271431,Washington
St. Francis Hospital - The Heart Center (Cardiac Fitness and Rehabilitation),"100 Port Washington Blvd Roslyn, NY 11576",40.8049276,-73.6699466,New York
St. Francis Medical Center (St. Francis Medical Center Cardiac Rehabilitation),"150 S Mount Auburn Rd. Cape Girardeau, MO 63703",37.303458,-89.5729695,Missouri
St. Francis Memorial Hospital (St. Francis Memorial Hospital Cardiac Rehabilitation),"430 North Monitor West Point, NE 68788",41.8431902,-96.7060899,Nebraska
St. Francis Memorial Hospital (St. Francis Memorial Hospital Cardiac Rehabilitation),"430 North Monitor West Point, NE 68788",41.8431902,-96.7060899,Nebraska
St. Francis Regional Medical Center (St. Francis Hospital Cardiac Rehabilitation),"1515 St Francis Ave Suite 105 Shakopee, MN 55379",44.7712264,-93.5024508,Minnesota
St. George Regional Hospital (St. George Regional Hospital Cardiac Rehabilitation),"1380 E. Medical Center Drive Saint George, UT 84770",37.0968017,-113.5539707,Utah
St. James Healthcare (SJHC Cardiac Rehab),"400 S. Clark St. Butte, MT 59701",46.0084722,-112.5455521,Montana
St. James Healthcare (Cardiac Rehab),"400 S. Clark St. Butte, MT 59701",46.0084722,-112.5455521,Montana
St. James Mercy Hospital (UR St. James Hospital Cardiac Rehabilitation),"411 Canisteo Street Hornell, NY 14843",42.3137289,-77.6604598,New York
St. John (Cardiac Rehabilitation),"22151 Moross Road Detroit, MI 48236",42.4198857,-82.9146893,Michigan
St. John Hospital and Medical Center - Romeo Plank (Cardiac Preventive and Rehabilitation Services - Macomb),"46591 Romeo Plank Road Macomb, MI 48044",42.6401002,-82.9374673,Michigan
St. John Hospital and Medical Center - Romeo Plank (Cardiac Preventive and Rehabilitation Services),"22151 Moross Road Professional Building 1, Suite 123 Detroit, MI 48236",42.4191051,-82.9135174,Michigan
St. John Hospital and Medical Center-Moross (Cardiac Preventive and Rehabilitation Services - Detroit),"22151 Moross Road Professional Building 1, Suite 123 Detroit, MI 48236",42.4191051,-82.9135174,Michigan
St. John Medical Center (Ascension St. John Medical Center Cardiac Rehab),"1819 East 19th Street Suite 301 Tulsa, OK 74104",36.135633,-95.9656401,Oklahoma
St. John Medical Center (Peacehealth) (St. John Medical Center Cardiac and Pulmonary Rehabilitation),"1615 Delaware Street Longview, WA 98632",46.1299701,-122.9415844,Washington
St. John's Medical Center (Cardiac Rehab),"PO Box 428 Jackson, WY 83001",43.4750131,-110.7663089,Wyoming
St. Johns NixaClinic (Cardiac Rehab),"940 W. Mt Vernon Nixa, MO 65714",37.0421209,-93.3139481,Missouri
St. John's Regional Medical Center (Cardiac Rehabilitation),"2727 McClelland Blvd. Joplin, MO 64804",37.0588116,-94.5327514,Missouri
St. John's Therapy Services - St. Robert (Cardiac Rehabilitation),"608 Old Route 66, PO Box 650 St. Robert, MO",37.8229299,-92.1610606,Missouri
St. Joseph Health Medical Group - Napa (St. Joseph Health Medical Group - Napa Cardiac Rehab),"1100 Trancas St. Suite 252 Napa, CA 94558",38.3236475,-122.298622,California
St. Joseph Hospital West (Cardiopulmonary Rehab),"100 Medical Plaza Lake Saint Louis, MO 63367",38.802799,-90.7754904,Missouri
St. Joseph Medical Center (St. Joseph Medical Center Cardiac Rehabilitation),"1717 South J Street MS 01-10 Tacoma, WA 98405",47.2452548,-122.4481819,Washington
St. Joseph Medical Center (St Joseph Medical Center Cardiac Rehabilitation),"1000 Carondelet Dr Kansas City, MO 64114-4673",38.9348578,-94.6038428,Missouri
St. Joseph Medical Center (St. Joseph Medical Center Cardiac Rehab),"1800 N California St Stockton, CA 95204-6019",37.9698831,-121.2886669,California
St. Joseph Memorial Hospital (Cardiovascular Rehabilitation),"2 Hospital Lane Murphysboro, IL 62966",37.7740652,-89.3245484,Illinois
St. Joseph Mercy Chelsea (St. Joseph Mercy Chelsea Cardiac Rehab),"775 S Main St Chelsea, MI 48118-1383",42.3100294,-84.0169076,Michigan
St. Joseph Mercy Hospital -Oakland (St. Joseph Mercy Hospital - Oakland Cardiac Rehabilitation),"44405 Woodward Ave Pontiac, MI 48341",42.6128953,-83.2758541,Michigan
St. Joseph Mercy Livingston Hospital (St. Joseph Mercy Hospital Howell Cardiac Rehab),"620 Byron Road Howell, MI 48843",42.6155619,-83.9411171,Michigan
St. Joseph's Hospital (St. Joseph' s Hospital Cardiac Rehabilitation),"3003 Martin Luther King Jr. Drive MAB 2ND FLOOR Tampa, FL 33607-6307",27.9826585,-82.4922184,Florida
St. Joseph's Hospital (St. Joseph's Hospital Cardiac Rehabilitation),"1 Amalia Drive Buckhannon, WV 26201",38.9914779,-80.2362266,West Virginia
St. Joseph's Hospital Health Center (St. Joseph's Hospital Health Center Cardiac Rehabilitation),"7246 Janus Park Drive Liverpool, NY 13088",43.120925,-76.1659164,New York
St. Joseph's Medical Center (Cardiac Rehabilitation),"523 North 3rd Street Brainerd, MN 56401",46.3620054,-94.2058917,Minnesota
St. Joseph's University Medical Center (St. Joseph's University Medical Center Cardiac Rehabilitation Program),"703 Main Street Paterson, NJ 07503",40.8955467,-74.156292,New Jersey
St. Joseph's Wayne Medical Center (St. Joseph's Wayne Medical Center Cardiac Rehab),"234 Hamburg Tpke Wayne, NJ 07470",40.9467119,-74.2047225,New Jersey
St. Joseph's/Candler Health System (St. Joseph's/Candler Health System Center For Heart Disease Prevention & Management),"5356 Reynolds Street Ste. #120 Savannah, GA 31405",32.027919,-81.1002144,Georgia
St. Joseph's/Candler Health System (Center for Heart Disease Prevention and Management),"5356 Reynolds Street Suite 120 Savannah, GA 31405",32.027919,-81.1002144,Georgia
St. Jude Medical Center (Providence St. Jude Medical Center Cardiac Rehabilitation),"101 E. Valencia Mesa Dr. Suite 200 Fullerton, CA 92835",33.8943451,-117.9272201,California
St. Louis University (SLUCare Cardiac Rehabilitation),"1034 South Brentwood Blvd., Suite 1130 St. Louis, MO 63117",38.6364103,-90.3443018,Missouri
St. Luke's Cornwall Hospital (Montefiore St Luke's Cornwall Hospital Cardiac Rehab),"Cardiac Rehab 19 Laurel Avenue Cornwall, NY 12518",41.4353371,-74.0421415,New  York
St. Luke's Hospital (St. Luke's Hospital Cardiac Rehabilitation),"232 Wouth Woods Mill Road Therapy Services/Cardiac Rehab Chesterfield, MO 63017",38.6510878,-90.5032107,Missouri
St. Luke's Hospital (St. Luke's Hospital Cardiac Rehabilitation),"5901 Monclova Rd. Maumee, OH 43537",41.5569989,-83.682211,Ohio
