CMM Hasan Physician PC (Cardiac Rehabilitation),"87-19 168th St Jamaica, NY 11432-3627",40.7112211,-73.7951043,New York
Coastal Carolina Hospital (Cardiac Rehabilitation),"1000 Medical Center Drive Hardeeville, SC 29927",32.3146802,-81.0537304,South Carolina
Coliseum Medical Centers (Healthy Hearts Cardiac Rehabilitation),"350 Hospital Drive Macon, GA 31217",32.8473009,-83.618713,Georgia
College Station Medical Center (Cardiac Rehabilitation Program),"1604 Rock Prairie Rd Cardiac Rehabilitation Program College Station, TX 77845",30.5812822,-96.289711,Texas
College Station Medical Center (CSMC),"301 Landsburg Ln College Station, TX 77845",30.571671,-96.3061888,Texas
Colorado Plains Medical Center (Colorado Plains Rehabilitation),"1000 Lincoln St. Ft. Morgan, CO 80701",40.2608045294785,-103.795393808095,Colorado
Columbia - St. Mary's Ozaukee Campus (Ascension Columbia St. Mary's Ozaukee Cardiac Rehabilitation),"13111 N. Port Washington Road Mequon, WI 53097",43.2565785,-87.9261886,Wisconsin
Columbia Memorial Hospital (Columbia Memorial Hospital Cardiac Rehabilitation),"2055 Exchange St Suite 170 Astoria, OR 97103",46.1878292,-123.8191682,Oregon
Columbus Community Hospital (Columbus Community Hospital Cardiac Rehabilitation),"4600 38th Street PO Box 1800 Columbus, NE 68601",41.4302973,-97.3593904,Nebraska
Columbus Regional Hospital (Columbus Regional Hospital Cardiac Rehabilitation),"2400 East 17th Street Columbus, IN 47201",39.2169006,-85.8954683,Indiana
Common Spirit CHI St. Mary's (Common Spirit CHI St. Mary's Cardiac Rehab),"1301 Grundman Blvd Nebraska City, NE 68410-3319",40.6564185,-95.8625877,Nebraska
Community Health Network - East Campus (Community Hospital East Cardiac Rehab),"1500 N Ritter Ave Indianapolis, IN 46219",39.7881459,-86.0764807,Indiana
Community Heart and Vascular Hospital (Community Heart and Vascular Hospital Cardiac Rehabilitation),"8075 North Shadeland Avenue, Suite 130 Indianapolis, IN 46250",39.90191,-86.0444066,Indiana
Community Hospital (Community Hospital Cardiac Rehabilitation Phase 2),"901 MacArthur Blvd. Munster, IN 46321",41.551037,-87.5064193,Indiana
Community Hospital (Community Hospital Cardiac Rehabilitation Program),"1301 E H St P.O. Box 1328 McCook, NE 69001",40.2053372,-100.6081311,Nebraska
Community Hospital Grand Junction CO (Community Hospital Cardiac Rehab),"2351 G Rd Grand Junction, CO 81505-9641",39.1051146,-108.6151127,Colorado
Community Hospital of the Monterey Peninsula (Cardiac Rehabilitation),"Cardiopulmonary Wellness 576 Hartnell St. Monterey, CA 93940",36.5953705,-121.8963047,California
Community Hospital South (Community Hospital South Cardiac Rehab),"Outpatient Cardiopulmonary Rehab Dept. 1402 E. County Line Rd. South Indianapolis, IN 46227",39.6372037,-86.1324813,Indiana
Community Howard Regional Health (Community Howard Regional Health Cardiac Rehab),"3500 South Lafountain Street Kokomo, IN 46904-9011",40.4471686,-86.1250836,Indiana
Community Medical Center (Community Medical Center Cardiac Rehabilitation),"99 Highway 37 West Toms River, NJ 08757",39.9638264,-74.2157315,New Jersey
Community Medical Center (Community Medical Center Cardiac Rehab),"3502 Barada St Falls City, NE 68355",40.1016214,-95.5864304,Nebraska
Community Medical Center (Community Medical Center Cardiac Rehab),"2827 Fort Missoula Rd Missoula, MT 59804-7408",46.8476744,-114.0486987,Montana
Community Memorial Hospital (Community Memorial Hospital Cardiac Rehabilitation),"909 West First St. P.O. Box 148 Sumner, IA 50674",42.8474801,-92.0915633,Iowa
Concord Hospital (Concord Hospital Cardiac Rehabilitation),"250 Pleasant Street Suite 1600 Concord, NH 03301",43.19842,-71.5622415,New Hampshire
Concord Hospital-Laconia (Concord Hospital-Laconia Cardiac Rehab),"80 Highland St Laconia, NH 03246-3235",43.528536,-71.4632103,New Hampshire
Cone Health/Moses H. Cone Memorial Hospital (Cone Health/Moses H. Cone Memorial Hospital Cardiac Rehabilitation),"1200 North Elm Street GW 150 Greensboro, NC 27401",36.0910599,-79.7872518,North Carolina
Conemaugh Memorial Medical Center (Conemaugh Memorial Medical Center Cardiac Rehabilitation Program),"1086 Franklin Street Johnstown, PA 15905",40.3047101,-78.9187023,Pennsylvania
Confluence Health (Confluence Health Cardiac Rehab),"1201 S Miller St Wenatchee, WA 98801-3201",47.406135,-120.3204967,Washington
Conway Medical Center (Conway Medical Center Cardiac Rehabilitation),"2369 Cypress Cir Conway, SC 29526-8921",33.7844103,-79.0002672,South Carolina
Cookeville Regional Medical Center (Cookeville Regional Medical Center Cardiac Rehabilitation),"228 West 4th Street, Suite 100 Cookeville, TN 38501",36.168226,-85.510681,Tennessee
Cooley Dickinson Hospital (Cardiac Rehabilitation Program),"30 Locust Street Northampton, MD 01060",42.3303999,-72.6537368,Maryland
Coon Memorial Hospital (Coon Memorial Hospital CR Program),"1411 Denver Ave Dalhart, TX 79029",36.0516278,-102.5209785,Texas
Cooperman Barnabas Medical Center (Cooperman Barnabas Medical Center Cardiac Rehabilitation),"94 Old Short Hills Rd Saint Barnabas Medical Center- East Wing Livingston, NJ 07039-5672",40.7629282,-74.3037812,New Jersey
Copley Hospital (Copley Hospital),"528 Washington Hwy Morrisville, VT 05444",44.5532255,-72.5914576,Vermont
Copley Memorial Hospital (Copley Memorial Hospital - Aurora Cardiac Rehabilitation),"2088 Ogden Avenue Suite 120 Aurora, IL 60504",41.7302622,-88.2655085,Illinois
Copley Memorial Hospital - Yorkville (Copley Memorial Hospital - Yorkville Cardiac Rehabilitation),"1100 W Verterans Pkwy Suite 330 Yorkville, IL 60560",41.6594704,-88.4695481,Illinois
Corpus Christi Medical Center (Corpus Christi Medical Center Cardiac Rehabilitation),"7002 Williams Drive Corpus Christi, TX 78412",27.6928405,-97.3457059,Texas
Coshocton Regional Medical Center (Coshocton Regional Medical Center Cardiac Rehabilitation),"1460 Orange St Coshocton, OH 43812-2229",40.2710019,-81.8477934,Ohio
Coteau Des Prairies Health Care System (Coteau Des Prairies Cardiac Rehabilitation Program),"205 Orchard Drive Sisseton, SD 57262",45.6574454,-97.05006,South Dakota
Coteau Des Prairies Hospital (Coteau Des Prairies Cardiac Rehabilitation),"205 Orchard Dr. Sisseton, SD 57262",45.6574454,-97.05006,South Dakota
Coulis Cardiology (Coulis Cardiology Cardiac Rehabilitation),"1414 North Taylor Drive Sheboygan, WI 53081",43.7605405,-87.7503163,Wisconsin
Covenant Medical Center LifeStyle Centre (Covenant Medical Center LifeStyle Centre Cardiac Rehabilitation),"3615 19th Street Box 144 Lubbock, TX 79410",33.5769234,-101.8918876,Texas
Covenant Medical Center/Mercy Health Network (MercyOne-Waterloo),"3421 West Ninth St Suite 1253 Waterloo, IA 50702",42.4614809,-92.3460257,Iowa
Cox Health - Branson (CoxHealth - Branson Cardiac Rehab),"1150 State Highway 248 Suite 100 Branson, MO 65616-3758",36.6639914,-93.2362921,Missouri
Cox Monett Hospital (Cox Monett Hospital Cardiac Rehabilitation),"1000 E Highway 60 Monett, MO 65708",36.9154444,-93.8911131,Missouri
CoxHealth Branson West (CoxHealth Branson West Cardiac Rehabilitation Program),"18452 Business 13 Reeds Spring, MO 65737-9609",36.7010782,-93.3688485,Missouri
Crete Area Medical Center (Crete Area Medical Center Cardiac Rehabilitation),"2910 Betten Dr Crete, NE 68333",40.6406301,-96.9354224,Nebraska
Crittenton Hospital Medical Center (Cardiac Rehab Program),"1101 W. University Dr. Rochester, MI 48307",42.6796888,-83.1493212,Michigan
CRMC Wellness Center (Coffee Regional Medical Center),"200 Doctors Dr Ste 222 Douglas, GA 31533-2203",31.5110864,-82.8665219,Georgia
Crook County Medical Service District (Crook County Medical Service District CR Program),"P.O. Box 517 Sundance, WY 82729",44.4063746,-104.3757816,Wyoming
Crossing Rivers Health (Crossing Rivers Health Cardiac Rehabilitation),"37868 US Highway 18 Prairie Du Chien, WI 53821-8416",43.0216961,-91.1128784,Wyoming
Crozer Chester Medical Center (Crozer Cardiac Rehabilitation Center),"One Medical Center Blvd. Upland, PA 19013",39.8570634,-75.3666362,Pennsylvania
Cullman Regional Medical Center (Cullman Regional Medical Center Cardiac Rehabilitation),"PO Box 1108 1912 AL Hwy. 157 Cullman, AL 35056-1108",34.2059022,-86.845006,Alabama
Cumberland Medical Center (Cumberland Medical Center Cardiac Rehabilitation),"421 S Main St Crossville, TN 38555-5048",35.943392,-85.0218843,Tennessee
Cumberland Memorial Hospital (Cumberland Healthcare Cardiac Rehabilitation),"1705 16th Ave Cumberland, WI 54829",45.5425759,-92.055072,Wisconsin
CUMC - Bergan Mercy Hospital (CHI Health - CUMC - Bergen Mercy Hospital Cardiac Rehab),"7710 Mercy Road Suite 226 Omaha, NE 68124",41.2392441,-96.0310109,Nebraska
Dartmouth Hitchcock Medical Ctr (DHMC Cardiac Rehabilitation),"1 Medical Center Drive Lebanon, NH 03756",43.6760344,-72.2726469,New Hampshire
Davis Medical Center (Davis Medical Center Cardiac Rehabilitation),"812 Gorman Ave Elkins, WV 26241",38.9280765,-79.8540941,West Virginia
Day Kimball Hospital (Cardiac Rehabilitation),"320 Pomfret Street Putnam, CT 06255",41.9065432,-71.9137355,Connecticut
DCH Regional Medical Center (DCH Regional Medical Center Cardiac Rehabilitation),"809 University Boulevard East Medical Tower, 2nd Floor Tuscaloosa, AL 35401",33.2051666,-87.526571,Alabama
Deaconess Hospital (Deaconess Outpatient Heart & Lung Center),"910 W. 5th Ave., Suite 650 Spokane, WA 99204",47.6516906,-117.4251921,Washington
Decatur County Hospital (Dedicated Caring Healing (DCH)),"1405 Northwest Church Street Leon, IA 50144",40.7509899,-93.7468416,Iowa
Decatur County Memorial Hospital (Decatur County Memorial Hospital Cardiac Rehab),"720 N Lincoln St. Greensburg, IN 47420",39.3440127,-85.4786454,Indiana
Decatur Memorial Hospital (Decatur Memorial Hospital Cardiac Rehab),"2300 N Edward St Decatur, IL 62526-4163",39.8671025,-88.9614339,Illinois
Decatur Morgan Hospital (Decatur Morgan Cardiac Rehabilitation),"1874 Beltline Road Decatur, AL 35601",34.5764235,-87.0170646,Alabama
DeKalb Health (Cardiovascular Rehabilitation),"1316 East Seventh Street, P. O. Box 542 Auburn, IN 46706",41.3688901,-85.0354441,Indiana
DeKalb Medical Center (Heart Wellness),"2701 North Decatur Road Decatur, GA 30033",33.7915336,-84.2825631,Georgia
Del Sol LifeCare Center (Del Sol LifeCare Center Cardiac Rehab),"7852 Gateway East El Paso, TX 79915",31.7555034,-106.35174,Texas
"Delaware Valley Hospital, Inc. (UHS/Delaware Valley Hospital Cardiac Rehabilitation Program)","1 Titus Place Walton, NY 13856",42.1641361,-75.1289069,New York
Delhi Hospital (Delhi Hospital Cardiac Rehabilitation),"407 Cincinnati St. Delhi, LA 71232",32.4528555,-91.4937134,Louisiana
Delray Medical Center (Delray Medical Center Cardiac Rehabilitation),"5352 Linton Blvd Delray Beach, FL 33484-6514",26.4370058,-80.1276797,Florida
Delta County Memorial Hospital (Cardiac Rehabilitation),"1501 East 3rd Street P.O. Box 10100 Delta, CO 81416",38.7453519,-108.047069,Colorado
Delta Regional Medical Center (Delta Regional Medical Center Cardiac Rehab),"1400 E Union St CATH Lab Greenville, MS 38703-3246",33.4110128,-91.0353504,Mississippi
Denton Regional Medical Center (Medical City Denton Cardiac Rehabilitation),"3535 S. Interstate 35 E. Denton, TX 76210",33.1778414,-97.0910274,Texas
Denver Health Hospital (Healthy Hearts Cardiac Rehabilitation),"777 S Bannock St. Denver, CO 80204",39.7066695,-104.9899582,Colorado
DePaul Health Center (Cardiac Rehabilitation),"12303 DePaul Drive St. Louis, MO 63044-2588",38.7502554,-90.4341088,Missouri
Desert Springs Hospital (Desert Springs Hospital Cardiac Rehabilitation),"2075 E Flamingo Rd Las Vegas, NV 89119-5188",36.1129044,-115.1253166,Nevada
DeTar Healthcare System (DeTar Cardiac And Rehabilitation Education (CARE)),"605 E San Antonio St Ste 420 Victoria, TX 77901-6050",28.8074986,-96.9980063,Texas
Dignity Health Marian Regional Medical Center (Dignity Health Marian Regional Medical Center Cardiac Rehabilitation),"1207 E. Main St. Santa Maria, CA 93454",34.9540705,-120.4159421,California
Dignity Health/French Hospital (Dignity Health/French Hospital Cardiac Rehab),"1911 Johnson Avenue San Luis Obispo, CA 93401",35.2779659,-120.6512671,California
Divine Savior Healthcare (Cardiac Rehabilitation),"2817 New Pinery Road Portage, WI 53901",43.5671155,-89.4663678,Wisconsin
Doctors Community Hospital (Doctors Community Hospital Cardiac Rehabilitation),"8118 Good Luck Rd Lanham, MD 20706",38.9808223,-76.8651595,Maryland
Doctors Hospital - Ohio Health (OhioHealth Cardiac Rehab - Doctors Hospital),"5131 Beacon Hill Rd Ste 110 Columbus, OH 43228-4412",39.9530042,-83.1376765,Ohio
Doctors Hospital At Renaissance Imaging Center Main Campus (DHR Health Cardiac Rehab),"5521 DoctorS Drive Edinburg, TX 78539",26.254697,-98.2069727,Texas
Dominican Hospital (Dominican Hospital Cardiac Rehabilitation),"1555 Soquel Drive Santa Cruz, CA 95065",36.989473,-121.9844119,California
Dosher Memorial Hospital (Dosher Cardiac Rehab),"3009 Medical Plaza Ln Southport, NC 28461",33.9566085,-78.1376916,North Carolina
DownEast Community Hospital (Cardiac Rehab),"11 Hospital Drive Machias, ME 04654",44.7138148,-67.4763879,Maine
Doylestown Hospital (Doylestown Hospital Cardiac Rehabilitation),"595 West State Street Doylestown, PA 18901",40.3056669,-75.1463292,Pennsylvania
Dublin Methodist Hospital - Ohio Health (OhioHealth Cardiac Rehab - Dublin Methodist Hospital),"7500 Hospital Dr Ste 3728 Dublin, OH 43016-8518",40.1013879,-83.1646677,Ohio
Duke Raleigh Hospital Wellness Center (Cardiac Rehabilitation Program),"3301 Executive Dr. Raleigh, NC 27609",35.826906,-78.619315,North Carolina
Dukes Memorial Hospital (Dukes Memorial Hospital Cardiac Rehabilitation),"275 W. 12th St., Suite 100 Peru, IN 46970",40.7560108,-86.0843178,Indiana
"Durham Regional Hospital (Cardiac Rehabilitation, Wellness Institute)","3643 North Roxboro Road Durham, NC 27704",36.0361504,-78.9009894,North Carolina
EAMC-Lanier (EAMC-Lanier Cardiac Rehabilitation),"4800 48th Street Valley, AL 36854",32.8246478,-85.1685934,Alabama
East Alabama Medical Center (East Alabama Medical Center Cardiac Rehabilitation),"2000 Pepperell Parkway Opelika, AL 36801",32.6386458,-85.4053903,Alabama
East Jefferson General Hospital (East Jefferson Hospital Cardiac Rehabilitation),"4200 Houma Blvd. Cardiac Rehab Dept., 7 South Metairie, LA 70006",30.0105226,-90.1813132,Louisiana
East Ohio Regional Hospital (East Ohio Regional Hospital Cardiac Rehabilitation),"90 N. 4th St. Martins Ferry, OH 43935",40.0985195,-80.7203156,Ohio
East Orange General Hospital (Cardiac Rehab & Wellness),"240 Central Avenue 6th Floor, East Pavilion East Orange, NJ 07018",40.7536229,-74.2119646,New Jersey
East Texas Medical Center Fairfield (Cardiac Rehabilitation Program),"125 Newman St Fairfield, TX 75840-1419",31.72539,-96.1706795,Texas
Eastern Idaho Regional Medical Center (EIRMC Cardiac Rehab),"3100 Channing Way Idaho Falls, ID 83404",43.4699425,-111.9921783,Idaho
Eastern Niagara Hospital (Eastern Niagara Hospital Cardiac Rehabilitation),"521 East Ave. Lockport, NY 14094",43.177731,-78.6715667,New York
Eaton Rapids Medical Center (Cardiac & Vascular Health),"1500 S. Main Street Eaton Rapids, MI 48827",42.4949634,-84.6587832,Michigan
ECH-Heritage Inc DBA Vidant Edgecombe Hospital (Cardiac Rehab),"111 Hospital Drive Tarboro, NC 27886",35.9212265,-77.5556727,North Carolina
Edgerton Hospital and Health Services (Edgerton Hospital and Health Services Cardiac Rehabilitation),"11101 N Sherman Rd Edgerton, WI 53534-9002",42.833992,-89.0439894,Wisconsin
Edward Hospital (Edward Hospital Cardiac Rehabilitation - Naperville),"801 S. Washington St. Naperville, IL 60540",41.760967,-88.1501053,Illinois
Edward Hospital At Yorkville (Edward Hospital Cardiac Rehabilitation - Yorkville),"76 W. Countryside Parkway Yorkville, IL 60560",41.6609637,-88.446466,Illinois
Eisenhower Medical Center (Tamkin Cardiac Rehabiliation),"Renker Wellness Center 39000 Bob Hope Drive Rancho Mirage, CA 92270",33.7620931,-116.4055369,California
El Camino Hospital (El Camino Hospital Cardiac Rehabilitation),"2500 Grant Rd Sobrato 1F68 Mountain View, CA 94040",37.3697513,-122.0789275,California
Electra Memorial Hospital (Electra Memorial Hospital Cardiac Rehab),"1207 S Bailey St Caridac Rehab Department Electra, TX 76360-3221",34.0190559,-98.924405,Texas
Elizabethtown Community Hospital (Elizabethtown Community Hospital Cardiac Rehab),"66 Park Street Elizabethtown, NY 12932",44.2156947563829,-73.5981003603968,New York
Elkhart General Hospital (Elkhart General Hospital Cardiac Rehabilitation),"600 East Blvd Elkhart, IN 46514",41.6788523,-85.9927008,Indiana
Elliot Hospital (Elliot Hospital Cardiac Rehabilitation),"1 Elliot Way River's Edge Location Manchester, NH 03103",42.9840505,-71.4377617,New Hampshire
Elliot Hospital (The Elliot Pulmonary Rehabilitation),"185 Queen City Ave Manchester, NH 03101",42.9743441,-71.4684319,New Hampshire
Ellis Medicine (Ellis Medicine Cardiac Rehabilitation),"Ellis Medicine 1101 Nott Street Schenectady, NY 12308",42.8201106,-73.9160048,New York
Elmhurst Memorial Hospital (Elmhurst Memorial Hospital Cardiac Rehabilitation),"1200 S York St suite1260 Center for Health Elmhurst, IL 60126-5626",41.8640666,-87.9329553,Illinois
Ely Bloomenson Community Hospital (Ely-Bloomenson Community Hospital Cardiac Rehab),"328 W Conan St Ely, MN 55731-1145",47.9002795,-91.8724677,Minnesota
Emanate Health- Intercommunity Hospital (Emanate Health Cardiac Rehabilitation),"210 W San Bernardino Rd Covina, CA 91723-1515",34.088233,-117.8937523,California
Emerson Hospital (Emerson Hospital Cardiac Rehab and Prevention Department),"133 ORNAC Concord, MA 01742",42.451819,-71.375,Massachusetts
Emory Healthcare (Emory HeartWise Risk Reduction Program),"1525 Clifton Road, NE, Suite 508 Atlanta, GA 30322",33.7812086,-84.3231257,Georgia
Emory Saint Joseph's Hospital (Emory Saint Joseph's Hospital Cardiac Rehabilitation Program),"5673 Peachtree Dunwoody Rd Suite 490 Atlanta, GA 30342",33.9103244,-84.3503519,Georgia
Englewood Health (Englewood Health Cardiac Rehabilitation),"350 Engle St Englewood, NJ 07631-1808",40.9045845,-73.9675404,New Jersey
Erlanger Medical Center (Erlanger Medical Center Cardiac Rehabilitation),"325 Market Street STE 307 Chattanooga, TN 37402",35.0530409,-85.3101038,Tennessee
Essentia Health (Essentia Health Cardiac Rehabilitation),"3000 32nd Ave. S Fargo, ND 58103",46.831384,-96.8277872,North Dakota
Essentia Health  Hayward Clinic (Essentia Health  Hayward Clinic Cardiac Rehab),"11134 WI-77 Hayward, WI 54843",46.0352271,-91.48533,Wisconsin
Essentia Health  Moose Lake (Essentia Health  Moose Lake Cardiac Rehab),"4572 County Road 61 Moose Lake, MN 55767-9401",46.4416721,-92.7776564,Minnesota
Essentia Health - St. Mary's Hospital Superior (St. Mary's Hospital Superior Cardiac Rehab),"3500 Tower Ave Superior, WI 54880-4491",46.6975411,-92.1027222,Wisconsin
Essentia Health- Grand Rapids (Essentia Health  Grand Rapids Cardiac Rehab),"1542 Golf Course Rd Ste 203 Grand Rapids, MN 55744-3557",47.2201878,-93.5526038,Minnesota
Essentia Health St Mary's (Essentia Health St Mary's Cardiac Rehabilitation),"1027 Washington Ave Detroit Lakes, MN 56501",46.8135614,-95.8441725,Minnesota
Essentia Health-Sandstone (Essentia Health Sandstone Cardiac Rehab),"705 Lundorff Drive Sandstone, MN 55072-5120",46.1188356,-92.885243,Minnesota
Essentia Health-Virginia (Essentia Health-Virginia Cardiac Rehabilitation),"901 Ninth Street North Virginia, MN 55792",47.5313846,-92.5484879,Minnesota
Essentia St. Marys Medical Center (Essentia Health Duluth Cardiac Rehab),"407 E. 3rd St Duluth, MN 55804",46.7932732,-92.0966385,Minnesota
ETMC Rehabilitation (UT Health East Texas Cardiac Rehabilitation),"701 Olympic Plaza Tyler, TX 75701",32.3369318,-95.2919787,Texas
Evangelical Community Hospital (Evangelical Community Hospital Cardiac Rehab),"One Hospital Drive Lewisburg, PA 17837",40.9860895,-76.8817793,Pennsylvania
EvergreenHealth (EvergreenHealth Cardiac Rehabilitation),"12333 NE 130th Ln Tan Suite 225 Kirkland, WA 98034-7467",47.7160792,-122.1763808,Washington
Exeter Hospital (Exeter Hospital Cardiac Rehabilitation),"5 Alumni Drive Exeter, NH 03833",42.9833965,-70.9352553,New Hampshire
Fairbanks Memorial Hospital (Cardiac Rehab - Parker Heart Center),"Fairbanks, AK 99701",64.8400511,-147.7199756,Alaska
Fairfield Medical Center (Fairfield Medical Center Cardiac Rehabilitation),"401 N Ewing St 2nd Floor Gym Lancaster, OH 43130",39.717606,-82.5775809,Ohio
Fairmont Regional Medical Center (Fairmont Regional Medical Center Cardiac Rehab),"1325 Locust Ave Fairmont, WV 26554-1435",39.482633947164,-80.1654899185073,West Virginia
Fairview Grand Itasca Clinic & Hospital (Fairview Grand Itasca Cardiac Rehab Phase II),"1601 Golf Course Road Grand Rapids, MN 55744",47.2177068,-93.5627708,Minnesota
Fairview Hospital (Fairview Hospital Cardiovascular Rehabilitation),"18101 Lorain Avenue Cleveland, OH 44111",41.4501501,-81.8239595,Ohio
Fairview Hospital (Fairview Hospital Cardiac Rehabilitation),"29 Lewis Avenue Great Barrington, MA 01230",42.1910429,-73.3718828,Massachusetts
Fairview Lakes Medical Center (Fairview Lakes Medical Center Cardiac Rehab),"5200 Fairview Blvd Wyoming, MN 55092",45.3218275,-93.0000954,Minnesota
Fairview Northland Medical Center (Fairview Northland Medical Center Cardiac Rehabilitation),"919 Northland Drive Princeton, MN 55371",45.5585269,-93.5900066,Minnesota
Fairview Park Hospital (Rehab for Life),"200 Industrial Blvd. Dublin, GA 31021",32.5307736,-82.9514581,Georgia
Fairview Range Medical Center (Fairview Range Medical Center Cardiac Rehabilitation),"750 E 34th Street Hibbing, MN 55746",47.4094863,-92.9293996,Minnesota
Fairview Regional Medical Center (Fairview Regional Medical Center Cardiac Rehabilitation),"523 E State Rd Fairview, OK 73737-1453",36.2760386,-98.4745578,Oklahoma
Fairview Ridges Specialty Care Center (Fairview Ridges Cardiac Rehabilitation),"14101 Fairview Dr Ste 240 Burnsville, MN 55337-2522",44.7488559,-93.272816,Minnesota
Fairview Southdale Hospital (Fairview Southdale Hospital Cardiac Rehabilitation),"6363 France Ave South Suite 100 Edina, MN 55435",44.8869116,-93.3262785,Minnesota
Faith Regional Health Services (Faith Regional Health Services Cardiac Rehabilitation),"110 N. 29th Street. Suite 202 Norfolk, NE 68701",42.033852,-97.4540046,Nebraska
Fall River Health Services (Fall River Health Services Cardiac Rehab),"1201 Highway 71 S Hot Springs, SD 57747-8800",43.4172935,-103.4799902,South Dakota
Falmouth Hospital (Falmouth Hospital Cardiac Rehabilitation),"100 Ter Heun Drive Suite 100 Falmouth, MA 02540",41.5643088,-70.6222371,Massachusetts
Family Health Center at NYU Langone - Brooklyn (Family Health Center at NYU Langone - Brooklyn Cardiac Rehabilitation),"150 55th St LB 3202 Brooklyn, NY 11220-2508",40.6466634,-74.0209235,New York
Fauquier Health Wellness Center (Fauquier Health Wellness Center Cardiac Rehabilitation),"419 Holiday Court Suite 200 Warrenton, VA 20186",38.7230024,-77.7825164,Virginia
Faxton St. Luke's Healthcare (Faxton St. Luke's Healthcare Cardiac Rehabilitation),"1676 Sunset Avenue Utica, NY 13502",43.0912796,-75.2582971,New York
Fayette Regional Health System (Cardiac Rehabilitation Program),"1941 Virginia Ave. Connersville, IN 47331",39.656435771054,-85.1324863589849,Indiana
Ferrell Hospital (Ferrell Hospital Cardiac Rehab),"1201 Pine St Eldorado, IL 62930-1634",37.8155011,-88.4420932,Illinois
FHN (FHN CARDIOPULMONARY REHABILITATION),"1045 W. STEPHENSON ST. FREEPORT, IL 61032",42.2949828,-89.6385509,Illinois
Fillmore County Hospital (Fillmore County Hospital Cardiac Rehabilitation),"1900 F St. PO BOX 193 Geneva, NE 68361",40.5269512,-97.5958818,Nebraska
First Health of the Carolinas - Pinehurst (FirstHealth of the Carolinas Center for Health and Fitness- Pinehurst Cardiac Rehabilitation),"170 Memorial Drive Center for Health and Fitness Piinehurst, NC 28374",35.2071511,-79.4601047,North Carolina
FirstHealth of the Carolinas Center for Health and Fitness- Sanford (FirstHealth of the Carolinas Center for Health and Fitness- Sanford Cardiac Rehab),"2925 Beechtree Dr Sanford, NC 27330-6934",35.5192345428597,-79.1858774437897,North Carolina
FirstHealth of the Carolinas Center for Health and Fitness-Rockingham (FirstHealth of the Carolinas for Health and Fitness-Rockingham Cardiac Rehabilitation),"120 Richmond Memorial Drive Rockingham, NC 28379",34.9308081275064,-79.7496397142945,North Carolina
Fisher Titus Medical Center (Fisher Titus Medical Center Cardiac Rehabilitation),"272 Benedict Ave. Norwalk, OH 44857",41.2254465370116,-82.6036086319365,Ohio
FITT Life PT (FITT Life PT Cardiac Rehab),"189 Littleton Rd Parsippany, NJ 07054-1842",40.8656142,-74.4209904,New Jersey
Fitzgibbon Hospital (Buckner Wellness Center),"2305 S. 65 Highway Marshall, MO 65340",39.0915567,-93.2128672,Missouri
Flagler Hospital (Flagler Hospital Cardiac Rehabilitation Program),"120 Health Park Blvd. St. Augustine, FL 32086",29.8629648,-81.3205742,Florida
Flagstaff Medical Center (Cardiac Rehab),"1200 N. Beaver Street Flagstaff, AZ 86001",35.2088271,-111.6439178,Arizona
Fleming County Hospital (Fleming County Hospital Cardiac Rehab),"55 Foundation Dr Flemingsburg, KY 41041-9815",38.4223084,-83.751672,Kentucky
Florida Hospital Fish Memorial (Cardiovascular Rehabilitation Program),"1055 Saxon Blvd. Orange City, FL 32763",28.91414,-81.2851695,Florida
"Florida Hospital, DeLand (Cardiac Rehabilitation)","701 W. Plymouth Ave. DeLand, FL 32720",29.0437183,-81.317265,Florida
Flowers Hospital (Cardiac Rehabilitation Program of Flowers Hospital),"4370 W. Main Street Ste 104 P.O. Box 6907 Dothan, AL 36302",31.2370999,-85.4571519,Alabama
Folsom Fitness & Rehab Center @ Methodist Dallas Medical Center (Cardiac Rehab Program),"1441 North Beckley Ave. Dallas, TX 75203",32.7611756,-96.8255271,Texas
