Medical Center Arlington (Medical City Arlington Cardiac Rehab),"515 W Mayfield Rd Ste 118 Arlington, TX 76014-2084",32.69145,-97.1131,Texas,12167,25,53
Medical Center Hospital (Ann Roden Deaderick Cardiac Rehabilitation),"8050 E Highway 191 Ste 107 Odessa, TX 79765-8613",31.92172,-102.289,Texas,1167,2,4
Medical Center of South Arkansas (Cardiac Rehabilitation Services),"700 West Grove St. El Dorado, AR 71730",33.22155,-92.671,Arkansas,279,1,3
Medical Center of the Rockies (Medical Center of the Rockies Cardiac Rehabilitation),"2500 Rocky Mountain Avenue South Medical Office Bldg., Suite 170 Loveland, CO 80538",40.4156,-104.997,Colorado,1273,5,9
Medical City Dallas Hospital (Medical City Dallas Hospital Cardiac Rehabilitation),"7777 Forest Lane C-240 Dallas, TX 75230",32.91177,-96.7724,Texas,11088,24,54
Medical City Heart and Spine (Medical City Heart and Spine Cardiac Rehab),"11970 N Central Expy Dallas, TX 75243-3768",32.91204,-96.7667,Texas,11088,24,54
Medical City Lewisville (Medical City Lewisville Cardiac Rehabilitation Program),"Medical City Lewisville 500 W. Main Street Lewisville, TX 75057",33.04542,-97.005,Texas,13401,28,59
Medical City Plano (Medical City Plano Cardiac Rehabilitation),"3901 W 15th St Bldg 122 Plano, TX 75075-7738",33.02124,-96.7661,Texas,10912,24,54
Medical University Hospital Authority (Medical University Hospital Authority Cardiac Rehabilitation Program),"169 Ashley Ave Charleston, SC 29425-8905",32.78435,-79.9468,South Carolina,2070,5,10
Medical University of South Carolina (Medical University of South Carolina Cardiac Rehabilitation),"122 Bee St., Suite 201 MSC 202 Charleston, SC 29425",32.7861,-79.953,South Carolina,2070,5,10
Medical University of South Carolina (MUSC) (MUSC Health Florence Medical Center Cardiac Rehabilitation),"805 Pamplico Hwy Suite B110 Florence, SC 29501-0550",34.1601,-79.752,South Carolina,1266,6,9
MedStar Franklin Square Medical Center (Medstar Franklin Square Cardiac Rehabilitation),"9105 Franklin Square Drive suite 106 Baltimore, MD 21237",39.35054,-76.4767,Maryland,6445,13,24
MedStar Good Samaritan Hospital/Good Health Center (MedStar Good Samaritan Hospital/Good Health Center Phase II Cardiac Rehabilitation),"5601 Loch Raven Blvd O'Neill Building 2nd Floor Baltimore, MD 21239",39.35821,-76.5873,Maryland,7094,16,28
Medstar Montgomery Medical Center (MedStar Montgomery Medical Center Cardiac Rehabilitation),"18101 Prince Philip Dr Room 2082 Olney, MD 20832-1514",39.15406,-77.0547,Maryland,14037,25,45
Medstar Southern Maryland Hospital Center (MedStar Southern Maryland Cardiac Rehabilitation),"7503 Surratts Rd Clinton, MD 20735-3358",38.74821,-76.8759,Maryland,8239,18,26
Medstar Union Memorial Hospital (MedStar Union Memorial Hospital Cardiac Rehabilitation),"201 East University Parkway Cardiac Rehab Dept. Baltimore, MD 21218",39.3296,-76.6143,Maryland,7000,16,26
Medstar Washington Hospital Center (Medstar Washington Hospital Center Cardiac Rehab and Wellness Programs),"110 Irving Street, NW BB 43 Washington, DC 20010",38.9295,-77.0162,Washington DC,9798,22,33
"MedStar, St. Mary's Hospital (Grace Anne Dorney Cardiac Rehabilitation)","25500 Point Lookout Rd PO Box 527 Leonardtown, MD 20650",38.3021,-76.6382,Maryland,265,3,3
Meeker Memorial Hospital (Meeker Memorial Hospital and Clinics Cardiac Rehabilitation),"612 South Sibley Ave Litchfield, MN 55355",45.11961,-94.5291,Minnesota,316,4,5
Melrose-Wakefield Hospital (Melrose-Wakefield Cardiac Rehabilitation),"Hallmark Health 585 Lebanon Street Melrose, MA 02176",42.46062,-71.0617,Massachusetts,9306,33,46
Memorial Health Care Systems (Memorial Health Care Cardiac Rehab),"300 N Columbia Ave Seward, NE 68434-2228",40.90935,-97.0919,Nebraska,1109,7,11
Memorial Healthcare (Cardiac Rehab),"826 W. King St. Owosso, MI 48867",43.00547,-84.1795,Michigan,2309,5,10
Memorial Hermann Greater Heights (Memorial Hermann Greater Heights Cardiac Rehab),"1635 North Loop W 1st Floor, South Tower Houston, TX 77008-1532",29.81154,-95.4304,Texas,14213,19,60
Memorial Hermann Hospital Heart and Vascular Institute (Memorial Hermann Cardiac Rehabilitation),"6414 Fannin Street, Ste G 100 Houston, TX 77030",29.71386,-95.3979,Texas,13358,17,56
Memorial Hermann Memorial City (Memorial Hermann Memorial City Cardiac Rehab),"915 Gessner Suite 420 Houston, TX 77024",29.78022,-95.5451,Texas,13253,17,56
Memorial Hermann Southeast Hospital (Cardiac Rehab),"11800 Astoria Blvd Houston, TX 77089",29.58225,-95.2079,Texas,10875,11,41
Memorial Hermann Southwest Heart & Vascular Institute (Memorial Hermann Southwest Heart & Vascular Institute Cardiac Rehabilitation),"7600 Beechnut 1st Floor Pavilion Houston, TX 77084",29.69332,-95.5224,Texas,13122,16,54
Memorial Hermann The Woodlands (Memorial Hermann The Woodlands Cardiac Rehab),"9180 Pinecroft Dr. Suite 130 The Woodlands, TX 77380",30.17548,-95.4555,Texas,4582,9,27
Memorial Hospital (Memorial Hospital Cardiac Rehabilitation),"4500 Memorial Drive Belleville, IL 62226",38.54995,-90.0215,Illinois,7971,15,30
Memorial Hospital (Memorial Hospital Cardiac Rehabilitation),"3073 White Mountain Highway PO Box 5001 North Conway, NH 03860",44.06128,-71.1369,New Hampshire,75,2,3
Memorial Hospital (Memorial Hospital Cardiac Rehabilitation),"175 S. Union Blvd, Suite 230 Colorado Springs, CO 80910",38.82973,-104.793,Colorado,1272,2,6
Memorial Hospital and Health Care Center (Memorial Hospital and Healthcare Center Cardiac Rehabilitation),"800 W 9th St Jasper, IN 47546-2514",38.39598,-86.9401,Indiana,218,2,3
Memorial Hospital at Gulfport (Memorial Hospital at Gulfport Cardiac Rehabilitation),"PO Box 1810 4500 13th St, Gulfport, MS 39502-1810",30.36726,-89.1153,Mississippi,824,3,5
Memorial Hospital of Lafayette County (Memorial Hospital of Lafayette County Cardiac Rehabilitation),"800 Clay St. Darlington, WI 53530",42.68395,-90.11,Wisconsin,205,4,5
Memorial Hospital of Rhode Island (Program for Cardiac Rehabilitation and Prevention),"111 Brewster Street Pawtucket, RI 02860",41.87062,-71.3754,Rhode Island,4876,13,22
Memorial Hospital of South Bend (Memorial Hospital of South Bend Cardiac Rehab),"621 Memorial Dr South Bend, IN 46601-1063",41.6838,-86.2532,Indiana,1665,9,11
Memorial Hospital of Sweetwater County (Cardiac Rehabilitation),"1200 College Drive Rock Springs, WY 82901",41.58462,-109.235,Wyoming,115,1,2
Memorial Hospital of Union County (Memorial Hospital of Union County Cardiac Rehab),"500 London Avenue Marysville, OH 43040",40.23068,-83.369,Ohio,4936,16,13
Memorial Hospital West (Memorial Hospital West Cardiac Rehab),"703 N Flamingo Rd. Pembroke Pines, FL 33028",26.01337,-80.312,Florida,15091,13,39
Memorial Medical Center (Memorial Medical Center Cardiac Rehabilitation),"3136 Old Jacksonville Rd Springfield, IL 62704",39.78507,-89.7147,Illinois,1068,4,4
Memorial Medical Center (Memorial Medical Center Cardiac Rehabilitaiton),"1615 Maple Lane Ashland, WI 54806",46.56866,-90.8883,Wisconsin,35,1,1
Memorial Medical Center (Cardiac Rehabilitation),"2450 S Telshor Blvd Las Cruces, NM 88011-5069",32.29204,-106.736,New Mexico,521,1,4
Memorial North Park Hospital (Cardiopulmonary Rehabilitation and Prevention),"2051 Hamill Road Hixson, TN 37343",35.12524,-85.2377,Tennessee,6389,5,12
Memorial Regional Hospital (Memorial Regional Hospital Cardiac Rehab),"300 Hollywood Way Hollywood, FL 33021",26.01283,-80.1736,Florida,15091,14,39
Memorial University Medical Center (Memorial Health Cardiac Rehabilitation),"4700 Waters Avenue Savannah, GA 31404",32.03069,-81.0882,Georgia,1301,6,6
Menorah Medical Center (Cardio-Pulmonary Rehabilitation),"5721 West 119th Street Overland Park, KS 66209",38.91049,-94.6516,Kansas,3571,22,17
Mercer Health (Mercer Health Cardiac Rehab),"800 West Main Street Coldwater, OH 45828",40.48063,-84.6392,Ohio,618,8,8
Mercy - Berryville (Mercy - Berryville Cardiovascular Rehabilitation),"214 Carter Street Berryville, AR 72616",36.35897,-93.5517,Arkansas,389,4,5
Mercy Ambulatory Care Center (Cardiac Rehabilitation),"3669 Southwestern Blvd Orchard Park, NY 14127",42.78045,-78.7726,New York,3044,6,15
Mercy Fitzgerald Hospital (Outpatient Cardiac Rehab),"1503 Lansdowne Ave Mail Stop #113 Darby, PA 19023",39.92795,-75.2679,Pennsylvania,17066,33,62
Mercy General Hospital (Mercy General Hospital Cardiac Rehabilitation),"4001 J Street Sacramento, CA 95819",38.57043,-121.453,California,3716,4,14
Mercy Hammons Heart Institute (Mercy Springfield Cardiac Rehab),"Hammons Heart Institute 1235 E. Cherokee Springfield, MO 65804",37.17992,-93.2762,Missouri,1700,4,4
Mercy Harvard Hospital (Mercyhealth Cardiac Rehabilitation - Harvard),"901 Grant St. Harvard, IL 60033",42.42634,-88.607,Illinois,2906,12,17
Mercy Health - Fairfield Hospital (Mercy Health - Fairfield Hospital Cardiac Rehabilitation),"3000 Mack Rd Cardiopulmonary Rehab Fairfield, OH 45014",39.31268,-84.5179,Ohio,5872,18,23
Mercy Health Anderson (Bon Secours Mercy Health Anderson Cardiac Rehabilitation),"7495 State Road Suite 100 Cincinnati, OH 45255",39.08108,-84.3499,Ohio,5513,17,20
Mercy Health Clermont (Mercy Health Clermont Cardiac Rehabilitation Program),"2055 Hospital Drive Suite 120 Batavia, OH 45103-1978",39.08029,-84.1444,Ohio,5081,15,18
Mercy Health Muskegon Heart Center (Mercy Heart Center Cardiac Rehabilitation),"1212 E Sherman Blvd Muskegon, MI 49444-1879",43.20551,-86.2139,Michigan,567,3,6
Mercy Health Saint Mary's (Mercy Health Saint Mary's Cardiac Rehabilitation),"310 Lafayette Ave SE Ste 305 Grand Rapids, MI 49503-4693",42.95774,-85.6614,Michigan,2036,6,9
Mercy Health System (Mercyhealth Cardiac Rehab - Janesville),"1010 North Washington Street Janesville, WI 53548",42.69455,-89.0354,Wisconsin,1729,9,13
Mercy Hospital (Mercy Hospital Cardiac Rehabilitation),"851 E. Fifth St. STE. 160 Washington, MO 63090",38.55259,-91.0021,Missouri,1500,6,11
Mercy Hospital - Aurora (Mercy Hospital - Aurora Cardiac Rehabilitation Aurora),"500 South Porter Ave. Aurora, MO 65605",36.95956,-93.712,Missouri,1743,8,6
Mercy Hospital - Cassville (Mercy Hospital Cassville Cardiac Rehabilitation Cassville),"94 Main Street Cassville, MO 65625",36.67467,-93.8723,Missouri,264,5,6
Mercy Hospital Cadillac (Cardiac and Pulmonary Rehabilitation),"400 Hobart St. Cadillac, MI 49601",44.24547,-85.3897,Michigan,74,2,2
Mercy Hospital Carthage (Mercy Hospital Carthage Cardiac Rehabilitation),"3125 Dr. Russell Smith Way Carthage, MO 64836",37.13615,-94.3211,Mississippi,801,5,8
Mercy Hospital Ft. Smith (Mercy Hospital Ft. Smith Cardiac Rehabilitation),"7301 Rogers Ave Ft. Smith, AR 72903",35.35566,-94.3531,Arkansas,1088,1,8
Mercy Hospital Joplin (Mercy Hospital Joplin Cardiac Rehabilitation),"100 Mercy Way Suite 350 Joplin, MO 64804-4524",37.03655,-94.5098,Missouri,868,3,7
Mercy Hospital Lebanon (Cardiac Rehab),"100 Hospital Dr. Lebanon, MO 65536",37.68161,-92.6343,Missouri,58,2,1
Mercy Hospital Northwest AR (Mercy Hospital Northwest Arkansas Cardiac Rehabilitation),"2708 S Rife Medical Ln Ste. #230 Rogers, AR 72758-1452",36.31012,-94.1828,Arkansas,1183,3,8
Mercy Hospital Oklahoma City (Mercy Outpatient Cardiac Rehabilitation),"Attn.: Fitness Center 4140 W. Memorial Rd., Ste. LL1 Oklahoma City, OK 73120",35.6069,-97.5985,Oklahoma,4806,7,23
Mercy Hospital South (Mercy Hospital South Cardiac Rehabilitation),"10012 Kennerly Road Cardiac Rehab Ste 105 St. Louis, MO 63128",38.50588,-90.3804,Missouri,8608,18,32
Mercy Hospital Unity Campus (Mercy Hospital Unity Campus Cardiac Rehabilitation Department),"500 Osborne Road Unity Professional Building Suite 150 Fridley, MN 55432",45.10646,-93.2595,Minnesota,8359,20,22
Mercy Hospital-St. Louis (Casey Kesselheim),"625 S NEW BALLAS RD STE 6050 St. Louis, MO 63141",38.6449,-90.4479,Missouri,8339,18,31
Mercy Iowa City (Mercy Iowa City Cardiac Rehabilitation Program),"500 E. Market St Iowa City, IA 52245",41.66415,-91.5286,Iowa,2709,6,9
Mercy Medical Center (Cardiac Rehab),"701 10th St SE Cedar Rapids, IA 52403",41.97828,-91.6557,Iowa,2683,6,9
Mercy Medical Center (Cardiac Rehabilitation),"1111 6th Ave Suite 2275 Des Moines, IA 50314",41.59867,-93.6229,Iowa,2118,6,11
Mercy Medical Center (Cardiac Rehabilitation Program),"1343 Fountain Blvd. Springfield, OH 45504",39.94109,-83.8103,Ohio,3322,10,15
Mercy Medical Center (Mercy Medical Center Cardiac Rehabilitation),"1320 Mercy Dr NW Canton, OH 44708",40.81213,-81.3963,Ohio,3742,11,14
Mercy Medical Center - Dyersville (MercyOne Medical Center Dyersville Cardiac Rehabilitation),"1111 3rd St SW Dyersville, IA 52040-1725",42.47565,-91.1307,Iowa,567,4,7
Mercy Medical Center Clinton (MercyOne Clinton Medical Center Cardiac Rehab),"1410 N 4th St. Clinton, IA 52732",41.86163,-90.1892,Iowa,1324,6,10
Mercy Medical Center Shaw Heart and Vascular Center (Mercy Medical Center Cardiac Rehabilitation),"2700 Stewart Parkway Roseburg, OR 97471",43.24195,-123.367,Oregon,174,1,1
Mercy Medical Center/Weldon Building (Cardiac Rehabilitaion Mercy Medical Center),"P.O. Box 9012 Springfield, MA 01102",42.11,-72.6,Massachusetts,4574,16,15
Mercy Memorial Hospital (Cardiac Rehabilitation),"904 Scioto St. Urbana, OH 43078",40.10808,-83.7298,Ohio,1628,9,10
Mercy Regional Health Center (Cardiac Rehabilitation Program),"1823 College Ave PO Box 1289 Manhattan, KS 66505-1289",39.20112,-96.5993,Kansas,25,2,1
Mercy San Juan Medical Center (Mercy San Juan Medical Center Cardiac Rehabilitation),"6555 Coyle Ave Ste 250 Carmichael, CA 95608-0370",38.66853,-121.312,California,3747,6,15
Mercy St. Charles Hospital (Cardiac Rehabilitation),"2600 Navarre Ave. Oregon, OH 43616",41.63517,-83.4852,Ohio,3450,8,13
Mercy Willard Hospital (Cardiac Rehabilitation),"1100 Neal Zick Road Willard, OH 44890",41.03895,-82.7097,Ohio,1522,8,12
Mercy-Chicago Hospital and Medical Center (Franciscan Olympia Fields Hospital Cardiac Rehab),"3800 W 203 St. Heart & Vascular Center Olympia Fields, IL 60461",41.52214,-87.7103,Illinois,16729,43,54
Mercyhealth (Mercyhealth Javon Bea Hospital Cardiac Rehab),"2400 N Rockton Ave Rockford, IL 61103-3655",42.29834,-89.0994,Illinois,1984,7,11
Mercyhealth - Walworth (Mercyhealth Hospital & Clinic - Walworth Cardiac Rehab),"N2950 State Road 67 53147, WI Lake Geneva",42.59835,-88.5399,Wisconsin,1843,8,14
MercyOne Medical Center (MercyOne Des Moines Medical Center Cardiac Rehab),"411 Laurel Ave Suite 2275 Des Moines, IA 50314-2610",41.60898,-93.6268,Iowa,2135,7,12
MercyOne Medical Center Dubuque (MercyOne Medical Center Dubuque Cardiac Rehab),"250 Mercy Drive Dubuque, IA 52001-7320",42.49272,-90.6751,Iowa,605,5,8
MercyOne Newton (MercyOne Newton Cardiac Rehabilitation),"204 North 4th Avenue East Newton, IA 50208",41.70342,-93.051,Iowa,550,6,8
MercyONE North Iowa (Mercy One North Iowa Cardiac Rehabilitation),"621 S Illinois Ave Ste 102 Mason City, IA 50401-5489",43.14535,-93.1687,Iowa,661,1,5
MercyOne Oakland Medical Center (MercyOne Oakland Medical Center Cardiac Rehabilitation),"601 E 2nd Street Room 8 Oakland, NE 68045",41.83488,-96.4594,Nebraska,185,4,6
MercyOne Siouxland Medical Center (MercyOne Siouxland Medical Center Cardiac Rehabilitation),"801 5th St Sioux City, IA 51101-1326",42.49564,-96.4009,Iowa,855,2,3
Merit Health Central (Cardiac Rehabilitation),"1850 Chadwick Dr Jackson, MS 39204",32.28764,-90.2545,Mississippi,2650,5,9
Merit Health Natchez (Merit Health Natchez Cardiac Rehabilitation),"54 Sgt Prentiss Dr Natchez, MS 39120-4726",31.52786,-91.3914,Mississippi,257,1,4
Merit Health Wesley (Merit Health Wesley Cardiac Rehab),"210 W. Hospital Dr Hattiesburg, MS 39402",31.32554,-89.369,Mississippi,1147,3,6
Meritus Medical Center (Meritus Medical Center Cardiac Rehabilitation),"11116 Medical Campus Road Suite 2908 Hagerstown, MD 20742",39.62243,-77.6846,Maryland,1286,7,10
Methodist Charlton Medical Center (Methodist Charlton Medical Center Cardiopulmonary Rehabilitation),"3500 W. Wheatland Road Dallas, TX 75237",32.64628,-96.8772,Texas,13092,25,56
Methodist Fremont Health (Methodist Fremont Health Cardiac Rehab),"450 E 23rd St Fremont, NE 68025-2303",41.45326,-96.4915,Nebraska,2386,11,14
Methodist Healthcare - North Hospital (Methodist Healthcare - North Hospital Cardiac Rehab),"3950 New Covington Pike Ste 210 Memphis, TN 38128-2595",35.2353,-89.8921,Tennessee,10676,6,15
Methodist Hospital (Methodist Hospital Cardiac Rehabilitation),"4499 Medical Drive Suite 255 San Antonio, TX 78229",29.51076,-98.5738,Texas,5550,4,17
Methodist Hospitals (Cardiac Rehabilitation),"Cardiac Rehabilitation Center 753 E 81st Place Merrillville, IN 46410",41.47036,-87.3296,Indiana,7130,22,28
Methodist Jennie Edmundson Hospital (Methodist Jennie Edmundson Hospital Cardiac Rehabilitation),"933 East Pierce St. Council Bluffs, IA 51503",41.26774,-95.835,Iowa,3770,11,16
Methodist LeBonheur Healthcare (Methodist Germantown Cardiac Rehabilitation Program),"7460 Wolf River Blvd Memphis, TN 38138",35.11548,-89.8137,Tennessee,10576,6,14
Methodist Medical Center Of Oak Ridge (Methodist Medical Center of Oak Ridge Cardiac Rehabilitation),"200 New York Ave Ste 360 Oak Ridge, TN 37830-5274",36.02324,-84.2483,Tennessee,3750,9,10
Methodist University Hospital (Cardiac Rehabilitation),"1265 Union Ave, Memphis, TN 38104",35.13587,-90.0193,Tennessee,10576,6,14
MetroHealth Medical Center (MetroHealth Medical Center Cardiac Rehabilitation),"2500 MetroHealth Dr. Cleveland, OH 44109",41.46077,-81.6988,Ohio,9432,26,29
Metron of Cedar Springs (Smarterheart Cardiac Rehabilitation Program),"400 Jeffrey Street Cedar Springs, MI 49319",43.21832,-85.5414,Michigan,1765,7,8
Metron of Forest Hills (Smarter Heart Cardiac Rehab),"1095 Medical Park Drive Grand Rapids, MI 49546",42.94327,-85.5582,Michigan,1804,5,8
MetroWest Medical Center (Cardiac Rehab),"115 Lincoln Street Framingham, MA 01701",42.28508,-71.4189,Massachusetts,10437,35,49
MGH Cardiovascular Disease Prevention Center/MGH Heart Center (MGH Cardiac Rehabilitation),"25 New Chardon Street Suite 301 Boston, MA 02114",42.36205,-71.0618,Massachusetts,8734,31,42
MGH Intensive Cardiac Rehabilitation (MGH Intensive Cardiac Rehabilitation Program),"25 New Chardon Street Suite 301 Boston, MA 02114-4774",42.36205,-71.0618,Massachusetts,8734,31,42
MH Highlands Cashiers Medical Center (MH Highlands Cashiers Medical Center Cardiac Rehabilitation),"PO Box 190 171 Hospital Drive Highlands, NC 28741-7601",35.08572,-83.185,North Carolina,511,4,8
MHP Medical Center (Major Health Partners Cardiac Rehabilitation),"2451 Intelliplex Drive Shelbyville, IN 46176",39.56049,-85.7851,Indiana,3478,8,13
Miami Cardiac & Vascular Institute At Baptist Hospital (Cardiovascular Rehabilitation/Prevention and the Women Heart Program),"8900 North Kendall Drive 2BCVI Miami, FL 33176",25.68359,-80.3382,Florida,10921,9,28
Miami County Medical Center (Miami County Medical Center Cardiac Rehab),"2100 Baptiste Dr, Paola, KS 66071",38.56949,-94.8491,Kansas,383,10,5
Miami Valley Hospital (Miami Valley Hospital Cardiac Rehabilitation),"2350 Miami Valley Way Centerville, OH 45459",39.65246,-84.1145,Ohio,4023,10,17
Miami Valley Hospital North (Miami Valley Hospital North Cardiac Rehabilitation),"9000 North Main Street Dayton, OH 45415",39.85595,-84.2718,Ohio,3664,10,15
Mid Coast Hospital (Running Start Cardiac Rehabilitation),"123 Medical Center Drive Brunswick, ME 04011",43.90635,-69.8908,Maine,1767,5,10
Mid Columbia Medical Center (Mid Columbia Medical Center),"1700 East 19th St. 551 Lone Pine Blvd. Suite 200 The Dalles, OR 97058",45.60603,-121.139,Oregon,102,2,4
Middle Park Health (Middle Park Health Cardiac Rehab),"1000 Granby Park Dr. South Grandby, CO 80446",40.07644,-105.926,Colorado,48,1,3
Middlesex Health (Middlesex Health Cardiac Rehabilitation),"534 Saybrook Rd Fl 2CD Middletown, CT 06457",41.54184,-72.6207,Connecticut,7235,18,18
Midland Memorial Hospital (Midland Memorial Hospital - Cardiac Rehabilitation),"400 Rosalind Redfern Grover Parkway Midland, TX 79701-6407",31.99616,-102.1,Texas,1185,2,5
MidMichigan Health Alpena (MidMichigan Health Alpena Cardiac Rehabilitation),"1501 W. Chisolm St. Alpena, MI 49707",45.07787,-83.4493,Michigan,124,1,1
MidMichigan Health Clare (MidMichigan Health Clare Cardiac Rehab),"602 Beech St Clare, MI 48617-1466",43.8203,-84.7698,Michigan,500,3,4
MidMichigan Health Gladwin (MidMichigan Health Gladwin Cardiac Rehab),"609 Quarter St Gladwin, MI 48624-1941",43.97473,-84.4942,Michigan,613,6,6
MidMichigan Health Gratiot (MidMichigan Health Gratiot Cardiac Rehabilitation),"300 East Warwick Drive Alma, MI 48801",43.3906,-84.6634,Michigan,601,2,6
MidMichigan Health Houghton Lake (MidMichigan Health Houghton Lake Cardiac Rehab),"9249 W Lake City Rd Houghton Lake, MI 48629-9602",44.33513,-84.7977,Michigan,233,5,4
MidMichigan Medical Center West Branch (MidMichigan Medical Center West Branch Cardiac Rehabilitation),"2463 South M-30 West Branch, MI 48661",44.26371,-84.2443,Michigan,138,4,3
MidMichigan Medical Center-Midland (MidMichigan Medical Center-Midland),"2660 W Sugnet Rd Midland, MI 48640-6125",43.63496,-84.2589,Michigan,1859,8,12
MidState Medical Center (Cardiac Rehabilitation and Wellness),"435 Lewis Avenue Meriden, CT 06451",41.54935,-72.8008,Michigan,7088,20,18
Midwest Heart and Vascular Specialists (Midwest Heart and Vascular Specialists Cardiac Rehabilitation),"2330 E Meyer Blvd Ste. 501 Kansas City, MO 64132-1152",39.00867,-94.5604,Missouri,3709,21,20
Mile Bluff Medical Center (Mile Bluff Medical Center Cardiac Rehab),"1050 Division St Mauston, WI 53948-1931",43.7829,-90.0757,Wisconsin,240,7,6
Mille Lacs Health System (Cardiac Rehabilitation),"200 Elm St N Onamia, MN 56359",46.07318,-93.6625,Minnesota,77,1,2
Mills Health Center (Cardiovascular Fitness),"110 S. San Mateo Dr. San Mateo, CA 94401",37.56552,-122.325,California,11227,11,55
Mills Peninsula Health Services (Mills Peninsula Medical Center Cardiac Rehabilitation),"1501 Trousdale Blvd. Burlingame, CA 94010",37.59181,-122.383,California,9811,10,51
Mills Peninsula Medical Center (Mills Peninsula Medical Center Cardiac Rehabilitation),"100 South San Mateo Drive San Mateo, CA 94401",37.56504,-122.326,California,11227,11,55
Milton Hospital (Cardiac Rehabilitation Department),"199 Highland Street Milton, MA 02186",42.24673,-71.0748,Massachusetts,8503,31,40
Milton Hospital (Milton Hospital Cardiac Rehabilitation Program),"199 Reedsdale Road Milton, MA 02186",42.25144,-71.0772,Massachusetts,8503,31,40
Minneapolis VA Health Care System (Minneapolis VA Health Care System Cardiac Rehabilitation Program),"1 Veterans Dr Minneapolis VA Healthcare System Minneapolis, MN 55417-2309",44.90303,-93.205,Minnesota,8487,22,24
Mission Hospital (Mission Hospital Cardiac Rehab),"509 Biltmore Avenue Asheville, NC 28801",35.57819,-82.5493,,1441,6,6
Mission Hospital (Mission Hospital Cardiac Rehabilitation),"26732 Crown Valley Parkway Suite 281 Mission Viejo, CA 92691",33.56256,-117.665,,8049,6,39
Mission Hospital Cardiac Rehab (Heart Path Cardiac Rehab),"5 Vanderbilt Park Dr, Asheville, NC 28803",35.55585,-82.5409,North Carolina,1476,6,7
Mississippi Baptist Medical Center (Mississippi Baptist Medical Center Cardiac Rehab),"501 Marshall Street Suite G02 Jackson, MS 39202",32.31603,-90.1796,Mississippi,2710,5,11
Missouri Rehabilitation Center (Cardiac Rehabilitation Program),"600 N. Main Mt. Vernon, MO 65712",37.111,-93.8218,Missouri,809,5,4
Moberly Regional Medical Center (Moberly Regional Medical Center Wellness Center - Cardiac Rehabilitation),"Moberly Regional Medical Center Wellness Center 1515 Union Ave Moberly, MO 65270",39.42524,-92.4137,Missouri,124,1,2
Mobile Infirmary Hospital (Mobile Infirmary Medical Center Cardiac Rehabilitation),"169 Mobile Infirmary Blvd Mobile, AL 36607-3510",30.6933,-88.0823,Alabama,1953,5,6
MoJoes Gym (Cardiac Rehabilitation),"22 Broad St Milford, CT 06460",41.2218,-73.0568,Connecticut,6624,16,17
Monadnock Community Hospital (Cardiac Rehabilitation Program),"452 Old Street Road Peterborough, NH 03458",42.88864,-71.9364,New Hampshire,1964,10,12
Monmouth Medical Center (Joel Opatut Cardiac Rehabilitation Program),"300 Second Avenue Long Branch, NJ 07740",40.29555,-73.9853,New Jersey,13615,18,38
Monmouth Medical Center Southern Campus (Monmouth Medical Center Southern Campus Cardiac Rehab),"600 River Ave Lakewood, NJ 08701-5237",40.07319,-74.2188,New Jersey,4427,13,13
Monongalia General Hospital (Mon Health Medical Center Cardiac Rehabilitation),"1200 JD Anderson Drive Morgantown, WV 26505",39.66393,-79.9467,West Virginia,1580,6,8
Monroe Clinic and Hospital (Monroe Clinic Cardiac Rehabilitation),"515 22nd Avenue Monroe, WI 53566",42.60749,-89.6335,Wisconsin,220,3,3
Monroe County Hospital and Clinic (Outpatient Cardiac Rehabilitation),"6580 165th Street Albia, IA 52531",41.04353,-92.7968,Iowa,420,4,8
Montefiore Medical Center (Montefiore Medical Center Cardiac Rehabilitation),"1500 Blondell Ave Bronx, NY 10461",40.84595,-73.8451,New York,41283,41,105
Montefiore New Rochelle Hospital (Montefiore New Rochelle Hospital Cardiac Rehabilitation Department),"2365 Boston Post Road Suite 204 Larchmont, NY 10538",40.92328,-73.7602,New York,39671,41,102
Montefiore Nyack Hospital (Montefiore Nyack Hospital Cardiac Rehabilitation),"160 N Midland Ave Nyack, NY 10960-1912",41.09588,-73.9261,New York,31320,36,80
Montgomery County Memorial Hospital (Montgomery County Memorial Hospital Cardiac Rehabilitation),"2301 Eastern Avenue P.O. Box 498 Red Oak, IA 51566",41.02757,-95.2157,Iowa,1006,5,7
Montrose Memorial Hospital (Montrose Memorial Hospital Cardiac Rehab),"800 South Third St Montrose, CO 81401",38.48002,-107.869,Colorado,124,2,2
Monument Health Rapid City Hospital (Monument Health Rapid City Hospital Cardiac Rehab),"353 Fairmont Blvd. Rapid City, SD 57701",44.05845,-103.225,South Dakota,463,2,4
Monument Health Spearfish Hospital (Monument Health Spearfish Cardiac Rehabilitation),"1440 N Main St. Spearfish, SD 57783",44.49825,-103.861,South Dakota,103,4,4
Monument Health Sturgis Hospital (Monument Health Sturgis Hospital Cardiac Rehab),"949 Harmon Street Sturgis, SD 57785",44.40228,-103.508,South Dakota,513,4,5
