Riverview Health (Riverview Health Cardiac Rehabilitation),"323 South Minnesota Street Crookston, MN 56716",47.7735,-96.6175,Minnesota,398,2,4
Riverview Health (Riverview Health Cardiac Rehabilitation),"395 Westfield Road Noblesville, IN 46060",40.04577,-86.0235,Indiana,5235,11,23
Riverview Medical Center (Riverview Medical Center Cardiac Rehabilitation),"1 Riverview Plaza Red Bank, NJ 07701",40.35368,-74.064,New Jersey,23981,29,60
Roane General Hospital (Roane General Hospital Cardiac Rehabilitation),"200 Hospital Drive Spencer, WV 25276",38.81577,-81.368,West Virginia,127,1,3
Roane Medical Center (Cardiac Rehab),"PO Box 489 Harriman, TN 37748",35.93396,-84.5524,Tennessee,1773,7,7
Robert Packer Hospital - Towanda Campus (Robert Packer Hospital - Towanda Campus Cardiac Rehab),"91 Hospital Drive Towanda, PA 18848",41.78401,-76.4482,Pennsylvania,593,4,4
Robert Packer Hospital Sayre Campus (Robert Packer Hospital - Sayre Campus Cardiac Rehab),"1 Guthrie Square Sayre, PA 18840",41.98025,-76.5208,Pennsylvania,658,4,5
Robley Rex VA Medical Center (Cardiac Rehabilitation),"800 Zorn Avenue Louisville, KY 40206",38.27031,-85.697,Kentucky,4504,18,15
Rochester Regional Health (Unity Cardiac Rehabilitation),"2655 Ridgeway Ave. Suite 210 Rochester, NY 14626",43.18583,-77.7058,New York,2210,3,6
Roper Hospital (Roper Cardiac Wellness and Rehabilitation),"316 Calhoun St 1 West Cardiac Rehab Charleston, SC 29401-1113",32.78284,-79.9495,South Carolina,2070,5,10
Rose Medical Center (Rose Medical Center Cardiac Rehabilitation),"4567 E 9th Avenue Denver, CO 80220",39.73219,-104.934,Colorado,6102,16,26
Rumford Hospital (Rumford Hospital Cardiac Rehabilitation),"420 Franklin Street Rumford, ME 04276",44.55159,-70.5563,Maine,170,3,4
Rush Oak Park Hospital (Rush Oak Park Cardiac Rehab),"520 S Maple Ave Cardiac Rehab Dept Oak Park, IL 60304",41.87865,-87.8032,Illinois,21726,51,71
Russell County Hospital (Cardiopulmonary Rehab),"PO Box 1610 Dowell Road Russell Springs, KY 42642",37.06106,-85.0672,Kentucky,623,1,9
Russell Medical (Russell Medical Cardiopulmonary Rehab),"3316 Hwy 208 Suite 6-2D Alexander City, AL 35010",32.94401,-85.9539,Alabama,417,1,5
Rutherford Regional Health System (Rutherford Regional Health System Cardiac Rehabilitation),"288 South Ridecrest Street Rutherfordton, NC 28139",35.36238,-81.9659,North Carolina,1748,5,9
Rutland Regional Medical Center (Healthy Hearts-Cardiac Rehabilitation),"160 Allan Street Rutland, VT 05701",43.59834,-72.9551,Vermont,233,3,5
RWJ Barnabas Health (RWJUH Somerset),"110 Rehill Ave Somerville, NJ 08876-2519",40.56811,-74.595,New Jersey,12149,22,35
RWJ Barnabas Health - New Brunswick (RWJ Barnabas Health Cardiac Rehab - Edison),"4 Ethel Rd Edison, NJ 08817-2841",40.54123,-74.396,New Jersey,29386,39,73
RWJ Barnabas Health - New Brunswick (RWJ Barnabas Health Cardiac Rehab - Monroe),"111 Union Valley Rd Ste 201A Monroe Township, NJ 08831-6000",40.30378,-74.4577,New Jersey,11454,22,36
RWJ Barnabas Health - New Brunswick (RWJ Barnabas Health - Cardiac Rehab East Brunswick),"593 Cranbury Rd Cardiac Rehab East Brunswick, NJ 08816-4093",40.40946,-74.4211,New Jersey,16762,26,47
Sacred Heart Health System (Ascension Sacred Heart Cardiac Rehab - Pensacola),"1601 Airport Blvd Pensacola, FL 32504-8617",30.48076,-87.2113,Florida,1872,4,6
Sacred Heart Hospital on The Emeral Coast (Sacred Heart Hospital Cardiac Rehab),"7800 US Highway 98 West Miramar Beach, FL 32550",30.37865,-86.307,Florida,578,3,6
Saddleback Memorial Medical Center (Saddleback Memorial Medical Center Cardiac Rehabilitation - Heart and Wellness Center),"24401 Calle De La Louisa, Suite 202 Laguna Hills, CA 92653",33.6084,-117.707,California,8960,6,44
Saint Agnes Hospital (Saint Agnes Hospital Cardiac Rehabilitation),"900 S. Caton Ave Baltimore, MD 21229",39.27183,-76.6742,Maryland,8776,17,30
Saint Agnes Medical Center (Saint Agnes Medical Center Cardiac Rehabilitation),"1303 E Herndon Ave, Fresno, CA 93720",36.8352,-119.766,California,1861,3,10
Saint Alphonsus Regional Medical Center (Cardiac Rehabilitation),"6140 W Curtisian Ave Ste 301 Boise, ID 83704-8880",43.61502,-116.256,Idaho,1349,7,7
Saint Anthony Health Michigan City (Franciscan Health Michigan City Cardiac Rehab),"301 W Homer Street Michigan City, IN 46360",41.70639,-86.9006,Indiana,1947,9,9
Saint Francis Health System (Saint Francis Health System Outpatient Cardiac Rehab),"Outpatient Cardiac Rehab 6151 S. Yale, Suite 101AA Tulsa, OK 74136",36.07253,-95.9207,Oklahoma,3269,7,14
Saint Francis Hospital Muskogee (Saint Francis Hospital Muskogee Cardiac Rehabilitation),"300 Rockefeller Dr. Muskogee, OK 74401",35.75264,-95.4059,Oklahoma,563,2,4
Saint Helena Hospital (Saint Helena Hospital Cardiac Rehab),"999 Adams St Ste 106B Saint Helena, CA 94574-1148",38.50524,-122.47,California,1821,4,16
Saint Joseph Hospital (Saint Joseph Hospital Cardiac Rehabilitation),"1960 N Ogden St Midtown I, Suite 030 Denver, CO 80218-3666",39.7464,-104.974,Colorado,6159,16,27
Saint Joseph Hospital (Cardiac Rehabilitation Services),"2900 North Lake Shore Drive Chicago, IL 60657",41.93409,-87.6374,Illinois,19859,44,64
Saint Joseph Regional Medical Center (Saint Joseph Regional Medical Center Cardiac Rehab),"611 E Douglas Rd Suite #215 Mishawaka, IN 46545",41.70679,-86.1742,Indiana,1665,9,11
Saint Luke's East Hospital (Saint Luke's East Hospital Cardiac Rehabilitation),"20 NE Saint Lukes Blvd Lees Summit, MO 64701",38.94032,-94.3813,Missouri,3571,21,17
Saint Luke's Hospital of Kansas City (Saint Luke's Hospital Cardiac Rehabilitation),"4401 Wornall Rd Outpatient Cardiac Rehabilitation Kansas City, MO 64111-3220",39.0461,-94.5899,Missouri,3709,21,20
Saint Luke's South Hospital (Saint Luke's South Hospital Outpatient Cardiac Rehabilitation),"12300 Metcalf Ave Overland Park, KS 66213-1324",38.90383,-94.6692,Kansas,3571,22,17
Saint Mary Medical Center (Cardiac Rehabilitation),"1201 Langhorne Newtown Road Langhorne, PA 19047",40.20259,-74.9252,Pennsylvania,14559,25,54
Saint Patrick Hospital Providence (Saint Patrick Hospital Providence Cardiac Rehabilitation),"500 W Broadway St Missoula, MT 59802",46.87556,-114.0,Montana,404,3,2
Saint Thomas Rutherford Hospital (Cardiac Rehabilitation at The Wellness Center),"1840 Medical Center Parkway Suite 203 Murfreesboro, TN 37130",35.86074,-86.4267,Tennessee,6168,9,15
Saint Thomas West Hospital (Saint Thomas West Hospital Cardiac Health and Rehabilitation),"Cardiac Health and Rehabilitation 4220 Harding Road Nashville, TN 37205",36.12925,-86.8445,Tennessee,6815,13,18
Salem Community Hospital (Cardiac Rehabilitation Program),"1995 East State Street Salem, OH 44460",40.90016,-80.8324,Ohio,2459,4,13
Salem Health (Salem Health Cardiac Rehab),"890 Oak St SE Bldg B PO Box 14001 Salem, OR 97301-3905",44.93256,-123.034,Oregon,1023,7,9
Salem Medical Center (Salem Medical Center Cardiac Rehab),"310 Woodstown Rd Salem, NJ 08079",39.70763,-75.3179,New Jersey,14020,28,47
Salinas Valley Memorial Healthcare System (Salinas Valley Health Medical Center Cardiac Rehabilitation),"450 E Romie Ln Salinas, CA 93901-4029",36.65949,-121.646,California,1106,3,8
Saline Heart Group (Cardiac Rehabilitation),"1000 Highway 35 N Ste 8 Benton, AR 72019-2353",34.5731,-92.5924,Arkansas,3068,18,12
Samaritan Albany General Hospital (Samaritan Albany General Hospital Cardiac Rehabilitation),"620 Elm Street SW Albany, OR 97321",44.63171,-123.115,Oregon,875,5,6
Samaritan Health Services (Good Samaritan Regional Medical Center Cardiac Rehabilitation Program),"3600 NW Samaritan Drive Corvallis, OR 97330",44.60346,-123.252,Oregon,875,5,6
Samaritan Healthcare (Samaritan Healthcare Cardiac Rehab),"801 E Wheeler Rd Moses Lake, WA 98837-1820",47.12848,-119.266,Washington,99,1,4
Samaritan Hospital (Samaritan Hospital Cardiac Rehab),"2215 Burdett Ave Fl 1 Troy, NY 12180-2466",42.7334,-73.6733,New York,2602,8,10
Samaritan Lebanon Community Hospital (SLCH Cardiac Rehabilitation),"35 Mullins Drive, Suite 3 PO Box 739 Lebanon, OR 97355",44.55005,-122.909,Oregon,850,5,5
Samaritan Medical Center (Samaritan Medical Center Cardiac Rehabilitation),"830 Washington St. Watertown, NY 13601",43.96437,-75.9133,New York,361,1,4
Samaritan Pacific Communities Hospital (SPCH Cardiac Rehabilitation),"930 SW Abbey Street Newport, OR 97365",44.62842,-124.06,Oregon,50,1,2
San Tan Cardiovascular Center (San Tan Cardiovascular Wellness Center),"6859 E Rembrandt Ave STE 117 Mesa, AZ 85212",33.34065,-111.685,Arizona,6655,15,30
Sanford Bemidji Medical Center (Cardiac Rehabilitation),"1300 Anne ST NW Bemidji, MN 56601",47.50341,-94.8994,Minnesota,171,1,4
Sanford Chamberlain Medical Center (Phase 2 Cardiac Rehab),"Chamberlain, SD 57325",43.81083,-99.3307,South Dakota,25,1,1
SANFORD HEALTH BISMARCK (Sanford Health Bismarck Cardiac Rehabilitation),"225 N 7th St. Bismarck, ND 58501",46.80718,-100.781,North Dakota,521,2,2
Sanford Health Fargo (Sanford Cardiovascular Rehabilitation),"720 N 4th St. Fargo, ND 58123",46.88496,-96.7861,North Dakota,941,2,4
Sanford Luverne Medical Center (Sanford Luverne Medical Center Cardiac Rehabilitation),"1600 N Kniss Ave Luverne, MN 56156-1067",43.67211,-96.2109,Minnesota,1287,3,8
Sanford USD Medical Center (Sanford USD Medical Center Cardiac Rehabilitation),"1305 W. 18th St. Sioux Falls, SD 57117",43.53594,-96.7419,South Dakota,1229,3,7
Santa Barbara Cottage Hospital (Santa Barbara Cottage Hospital Cardiac Rehab),"400 W Pueblo St Cardiac Rehab/Therapy Services Santa Barbara, CA 93105",34.42956,-119.724,California,979,1,6
Sarasota Memorial Healthcare System (Sarasota Memorial Healthcare Cardiac Rehabilitation),"1700 S Tamiami Trl Sarasota, FL 34239",27.31856,-82.5317,Florida,2398,2,8
Sauk Prairie Healthcare (Sauk Prairie Healthcare Cardiac Rehab),"260 26th St Prairie Du Sac, WI 53578",43.28684,-89.7528,Wisconsin,1760,10,8
Saunders Medical Center (Saunders Medical Center Cardiac Rehabilitation),"1760 Co Rd J Wahoo, NE 68066",41.19342,-96.6357,Nebraska,1352,6,11
Scheurer Hospital (Scheurer Hospital Cardiac Rehabilitiation Program),"170 N. Caseville Rd. Pigeon, MI 48755",43.8342,-83.2782,Michigan,133,2,4
Schneck Medical Center (Schneck Medical Center Cardiac Rehabilitation),"411 West Tipton Street Seymour, IN 47274",38.95583,-85.8916,Indiana,349,3,5
Scotland County Hospital (Cardiac Rehabilitation),"450 E Sigler Ave, Memphis, MO 63555",40.46547,-92.1646,Missouri,168,2,4
Scotland Memorial Hospital (Scotland Memorial Hospital Cardiac Rehabilitation),"500 Lauchwood Dr Laurinburg, NC 28352-5501",34.75291,-79.4678,North Carolina,727,2,7
Scott County Hospital (Scott County Hospital Cardiac Rehabilitation),"201 Albert Avenue Scott City, KS 67871",38.46692,-100.904,Kansas,75,1,3
Scott Memorial Health (Scott Memorial Health Cardiac Rehab),"1451 North Gardner Street Scottsburg, IN 47170",38.70463,-85.7863,Indiana,810,8,8
Scripps Memorial Hospital La Jolla (Scripps Memorial Hospital - La Jolla Cardiac Treatment Center),"9888 Genesee Ave, La Jolla, CA 92037",32.88515,-117.226,California,5937,9,22
Scripps Mercy Hospital (Center for Cardiac Health),"4077 5th Ave San Diego, CA 92103-2105",32.75109,-117.161,California,5569,8,21
Self Regional Healthcare (Self Regional Healthcare Cardiac Rehabilitation),"115 Academy Ave, Greenwood, SC 29646",34.17686,-82.1545,South Carolina,459,2,3
Sentara Albemarle Medical Center (Cardiac Rehabilitation Program),"1144 N Road St Elizabeth City, NC 27909-3473",36.3235,-76.218,North Carolina,541,3,3
Sentara CarePlex Hospital (Sentara CarePlex Hospital Cardiac Rehab),"3000 Coliseum Dr. Suite 120 Hampton, VA 23666",37.0569,-76.3898,Virginia,4276,11,14
Sentara Halifax Regional Hospital (Sentara Halifax Cardiac Rehabilitation),"2204 Wilborn Avenue South Boston, VA 24592",36.71248,-78.9142,Virginia,480,1,3
Sentara Heart Hospital Norfolk (Sentara Heart Hospital Norfolk Cardiac Rehabilitation),"600 Gresham Dr 1st floor Heart Hospital Norfolk, VA 23507-1904",36.86264,-76.3029,Virginia,3989,9,11
Sentara Leigh Hospital (Sentara Leigh Hospital Cardiac Rehabilitation),"Cardiac Rehabilitation Department 5460 Wesleyan Drive Virginia Beach, VA 23455-6906",36.87124,-76.1694,Virginia,3989,9,11
"Sentara Martha Jefferson Hospital (Health and Wellness Services, Cardiac Rehab)","590 Peter Jefferson Parkway, Suite 200 Suite 200 Charlottesville, VA 22911",38.0211,-78.4414,Virginia,819,2,2
Sentara Northern Virginia Medical Center (Sentara Northern Virginia Medical Center Cardiac Rehabilitation),"2300 Opitz Blvd Woodbridge, VA 22191",38.63693,-77.2862,Virginia,8620,15,25
Sentara Obici Hospital (Sentara Obici Hospital Cardiac Rehab),"2800 Godwin Blvd. Ground Floor Suffolk, VA 23434",36.77322,-76.581,Virginia,3774,8,11
Sentara Princess Anne Hospital (Sentara Princess Anne Cardiac Rehab),"2025 Glenn Mitchell Dr Virginia Beach, VA 23456-0178",36.77528,-76.0977,Virginia,3866,9,10
Sentara Rockingham Memorial Hospital (Sentara Rockingham Memorial Hospital Cardiac Rehabilitation),"2010 Health Campus Dr, Harrisonburg, VA 22801",38.40514,-78.8554,Virginia,566,4,3
Sentara Virginia Beach General Hospital Center for Cardiac Health and Wellness (Sentara Virginia Beach General Hospital Cardiac Rehabilitation),"1708 Old Donation Parkway Virginia Beach, VA 23454",36.86691,-76.0264,Virginia,3611,8,9
Sentara Williamsburg Regional Medical Center (Sentara Williamsburg Regional Medical Center Cardiac Rehabilitation),"Sentara Williamsburg Regional Medical Center 100 Sentara Circle Williamsburg, VA 23188",37.33665,-76.7406,Virginia,1210,4,6
Seton Highland Lakes (Seton Highland Lakes Cardiac Rehab),"3201 S WATER BUILDING 1B Burnet, TX 78611",30.7331,-98.2368,Texas,247,1,5
Seton Medical Center Hays (Cardiac Rehabilitation & Secondary Prevention),"6001 Kyle Parkway Kyle, TX 78640",30.00845,-97.8529,Texas,2867,8,18
Seven Rivers Regional Medical Center (Seven Rivers Regional Medical Center Cardiac Rehabilitation),"11541 Emerald Oaks Drive Crystal River, FL 34428",28.95374,-82.626,Florida,868,2,4
Seymour Hospital (Cardiac Rehabilitation),"200 Stadium Drive Seymour, TX 76380",33.59027,-99.2488,Texas,39,1,2
Shady Grove Adventist Medical Center (Center for Fitness and Health Cardiac Rehab),"9715 Medical Center Dr Ste 130 Rockville, MD 20850",39.09912,-77.198,Maryland,9324,19,31
Shaio Clinic (Centro de Prevencion Cardiovascular),"Diagonal 115A #70 C - 75 Bogota, TX 000",4.698391,-74.0725,Texas,0,1,0
Shamokin Area Community Hospital (Cardiac Rehab),"4200 Hospital Road Coal Township, RI 17866",40.80573,-76.5706,Rhode Island,1392,6,10
Shannon Medical Center (Shannon Medical Center Cardiac Rehabilitation),"102 North Magdalen Suite #140 San Angelo, TX 76903",31.46701,-100.433,Texas,504,1,2
Sharon Regional Health System (Cardiac Rehabilitation),"740 East State Street Sharon, PA 16146",41.23246,-80.4957,Pennsylvania,1846,4,12
Sharp Chula Vista Medical Center (Sharp Chula Vista Medical Center Cardiac Rehabilitation),"751 Medical Center Court Chula Vista, CA 91911",32.61965,-117.023,California,5044,6,18
Sharp Grossmont Hospital (Sharp Grossmont Hospital Cardiac Rehab),"5555 Grossmont Center Dr PO Box 158 La Mesa, CA 91942",32.78157,-117.007,California,5569,8,21
Sharp Memorial Hospital (Sharp Memorial Hospital Cardiac Program),"7901 Frost St San Diego, CA 92123-2701",32.79952,-117.155,California,5937,9,22
Shasta Regional Medical Center (Shasta Regional Medical Center),"1355 East St Redding, CA 96001",40.58638,-122.388,California,552,1,4
Shenandoah Medical Center (Shenandoah Medical Center Cardiac Rehabilitation),"300 Pershing Ave Shenandoah, IA 51601",40.75275,-95.3693,Iowa,1012,7,8
Sheridian Memorial Hospital (Cardiac Rehabilitation),"1401 W 5th Street Sheridan, WY 82801",44.80866,-106.976,Wyoming,88,1,1
Sherman Hospital (Cardiac Rehabilitation),"1019 East Chicago Street Elgin, IL 60120",42.03168,-88.2527,Illinois,9906,37,39
Shore Medical Center (Shore Medical Center Cardiac Rehabilitation),"710 Center St Somers Point, NJ 08244-1802",39.31462,-74.5956,New Jersey,1403,5,5
Shore Memorial Hospital (Cardiac Rehabilitation),"1 East New York Avenue Somers Point, NJ 8244",39.31478,-74.5941,New Jersey,1403,5,5
Sidney Regional Medical Center (Sidney Regional Medical Center Cardiac Rehab),"1000 Pole Creek Crossing Sidney, NE 69162-2901",41.1361,-102.952,Nebraska,25,1,1
Sierra - Providence Physical Rehabilitation Hospital (Cardiac Rehabilitation Program),"1740 Curie El Paso, TX",31.7788237,-106.4772147,Texas,2058,3,8
Sierra Nevada Memorial Hospital (Cardiac Rehabilitation),"155 Glasson Way Grass Valley, CA 95945",39.2278824,-121.0459398,California,389,2,3
Sierra Vista Regional Health Center (Cardiopulmonary Rehab),"300 El Camino Real Sierra Vista, AZ 85635",31.5517126,-110.27026,Arizona,136,1,3
Signature Healthcare Brockton Hospital (Cardiac Rehabilitation),"680 Centre St Brockton, MA 02302",42.0877929,-70.9913654,Massachusetts,10710,31,45
Siloam Springs Memorial Hospital (Cardiopulmonary Rehabilitation),"205 E Jefferson Siloam Springs, AR 72761",36.1818489,-94.5404043,Arkansas,1333,4,9
Silver Cross Hospital (Silver Cross Hospital Cardiac Rehabilitation),"1200 Maple Road Joliet, IL 60432",41.535333,-88.051039,Illinois,11634,35,43
Singing River Health System/ Ocean Springs Hospital (Singing River Health System/ Ocean Springs Hospital Cardiac Rehabilitation),"1175 Ocean Springs Rd Ocean Springs, MS 39564",30.414377,-88.7794184,Mississippi,1157,3,5
Singing River Health System/ Singing River Hospital (Singing River Health System/ Singing River Hospital Cardiac Rehabilitation),"3101 Denny Ave Suite 130 Pascagoula, MS 39581",30.3770285,-88.5301647,Mississippi,1073,3,4
Sioux Center Community Hopsital & Health Center (Cardiopulmonary Rehabilitation),"38 19th St SW Sioux Center, IA 51250",43.0580238,-96.1764395,Iowa,221,2,10
Sisters of Charity at St. Joseph Campus (Sisters of Charity Hospital St. Joseph Campus Cardiac Rehabilitation),"2605 Harlem Rd Buffalo, NY 14225-4018",42.9143415,-78.7823226,New York,3109,6,16
Sistersville General Hospital (Cardiac Rehabilitation Progam),"314 South Wells St. Sistersville, WV 26175",39.5586939,-81.0041568,West Virginia,420,3,5
Sky Ridge Medical Center (Sky Ridge Medical Center Cardiac Rehab),"10101 Ridgegate Pkwy Lone Tree, CO 80124-5522",39.5297665,-104.8716442,Colorado,5368,11,21
Sleepy Eye Medical Center (Sleepy Eye Medical Center Cardiac Rehabilitation),"400 4th Avenue NW Sleepy Eye, MN 56085",44.2995058,-94.7284803,Minnesota,153,2,5
Slidell Memorial Hospital (Slidell Memorial),"1001 Gause Blvd. Slidell, LA 70458",30.2836667,-89.7701541,Louisiana,2760,9,13
Smyth County Community Hospital (Smyth County Community Hospital Cardiac Rehab),"245 Medical Park Drive Marion, VA 24354",36.8519149,-81.4882239,Virginia,558,4,6
Soldiers and Sailors Memorial Hospital (Soldiers & Sailors Memorial Hospital Cardiac Rehabilitation),"418 N. Main Street Penn Yan, NY 14527",42.6706422,-77.0610591,New York,589,4,7
South Arkansas Cardiac Rehab (The Professional Building) (South Arkansas Cardiac Rehab),"1010 N Dudney Rd Ste E Magnolia, AR 71753-2651",33.2755161,-93.2306081,Arkansas,107,1,2
South Arkansas Cardiac Rehab Pine Bluff (LDC Cardiac Rehab),"7200 S Hazel St Pine Bluff, AR 71603-7836",34.1514223,-92.0250851,Arkansas,327,2,2
South Baldwin Regional Medical Center (South Baldwin Regional Medical Center Cardiac Rehabilitation),"1613 N. McKenzie Street Foley, AL 36526",30.4257603,-87.6843081,Alabama,1842,5,5
South Central Regional Medical Center (South Central Regional Medical Center Cardiac Rehabilitation),"PO Box 607 Laurel, MS 39441",31.6944561,-89.1406904,Minnesota,1163,3,7
"South Denver Cardiology Associates, P.C., South Denver Heart Center (South Denver Cardiac Rehabilitation Clinic)","1000 SouthPark Drive Littleton, CO 80120",39.5669208,-105.0006764,Colorado,5837,14,24
South Florida Baptist Hospital (South Florida Baptist Hospital Cardiac Rehab),"301 N Alexander St Plant City, FL 33563-4303",28.0154998,-82.1388933,Florida,6546,8,22
South Georgia Medical Center (South Georgia Medical Cardiac Rehabilitation Center),"201 Pendleton Drive Suite 270 Valdosta, GA 31602",30.8640382,-83.2869504,Georgia,573,1,7
South Nassau Communities Hospital (Center for Cardiac Rehabiliation),"440 Merrick Road Oceanside, NY",40.6532926,-73.624811,New York,32933,29,83
South Shore Hospital (South Shore Hospital Cardiac Rehabilitation),"55 Fogg Road South Weymouth, MA 02190",42.1758242,-70.9541227,Massachusetts,8234,29,38
South Texas Health System - McAllen (South Texas Health System Heart Intensive Cardiac Rehab),"500 E Ridge Rd Ste 200 McAllen, TX 78503",26.184519,-98.2180084,Texas,1759,2,7
Southeast Alabama Medical Center (Southeast Health Cardiac and Pulmonary Rehabilitation),"1108 Ross Clark Circle P.O. Box 6987 Dothan, AL 36302-6987",31.2164043,-85.3636361,Alabama,925,2,6
Southeast Georgia Health System - Brunswick Campus (The John Jackson Hart - Cardiac Rehabilitation Unit),"2415 Parkwood Dr Brunswick, GA 31520-4722",31.1748322,-81.4843639,Georgia,340,1,2
Southeast Health (Southeast Health Cardiac Rehabilitation),"1701 Lacey Street Cape Girardeau, MO 63701",37.3108514,-89.5395907,Missouri,723,3,4
Southeast Iowa Regional Medical Center (Southeast Iowa Regional Medical Center Cardiac Rehab),"1221 S Gear Ave West Burlington, IA 52655",40.8094702,-91.1741496,Iowa,449,2,6
Southeast Louisiana Veterans Health Care System (Southeast Louisiana Veterans Health Care System Cardiac Rehab),"2400 Canal St New Orleans, LA 70119-6535",29.9631872,-90.0848148,Louisiana,4648,10,19
Southeastern Ohio Regional Medical Center (Southeastern Ohio Regional Medical Center Cardiac Rehabilitation),"1341 Clark Street Cambridge, OH 43725",40.0413148,-81.577294,Ohio,622,3,5
Southern Illinois Healthcare - Herrin (Southern Illinois Healthcare - Herrin Cardiovascular Pulmonary Rehab),"201 S. 14th Street Herrin, IL 62948",37.8012766,-89.0261475,Illinois,589,7,9
Southern Maine Health Care (SMHC Sanford Cardiac Rehab),"25 June Street Sanford, ME 04073",43.4482284,-70.7680784,Maine,1642,9,10
Southern Maine Health Care | Biddeford Campus (SMHC Biddeford Cardiac Rehabilitation),"1 Medical Center Drive Biddeford, ME 04005",43.477416,-70.4906826,Maine,1397,7,8
Southern New Hampshire Medical Center (Southern NH Medical Center Cardiac Rehabilitation),"SNHMC West Campus 29 Northwest Blvd Nashua, NH 03063",42.8000287,-71.5459815,New Hampshire,3162,17,19
Southern Ocean Medical Center (Southern Ocean Medical Center Cardiac Rehabilitation),"1140 Route 72 West Manahawkin, NJ 08050",39.7215829,-74.285404,New Jersey,1899,5,6
Southern Ohio Medical Center (Southern Ohio Medical Center Cardiac Rehabilitation),"Cardiac Rehabilitation 1202 18th Street Portsmouth, OH 45662",38.7454856,-82.987698,Ohio,1141,3,6
Southern Regional Medical Center (Southern Regional Medical Center Cardiac Rehabilitation),"11 Upper Riverdale Road SW Riverdale, GA 30274-2615",33.5792393,-84.3898906,Georgia,8286,14,24
Southern TN Regional Health System-Lawrenceburg (Southern TN Regional Health System-Lawrenceburg Cardiac Rehab),"1607 S Locust Ave Lawrenceburg, TN 38464-4011",35.2224345,-87.3379455,Tennessee,219,2,3
Southern TN Regional Health System-Pulaski (Southern TN Regional Health System-Pulaski Cardiac Rehab),"1265 E College St Pulaski, TN 38478-4541",35.1916285,-87.0061934,Tennessee,594,3,6
Southlake Rehab (Cardiac Rehabilitation),"1516 N. Main Street Crown Point, IN 46307",41.4379444,-87.3634604,Indiana,7027,21,27
Southside Hospital Northwell Health (South Shore University Hospital Northwell Cardiac Rehab),"301 E Main St Bay Shore, NY 11706-8408",40.725875,-73.241786,New York,9359,12,26
Southside Regional Medical Center (Southside Regional Medical Center Cardiac Rehab),"430 Claremont Ct Colonial Heights, VA 23834",37.2677188,-77.4002174,Virginia,5791,8,14
Southwest Cardiovascular Intervention Clinic (Exercise And Cardiac Rehabilitation Clinic),"1508 N Zaragoza Rd Ste A El Paso, TX 79936-8039",31.739657,-106.289901,Texas,2058,3,8
Southwest General Health Center (Southwest General Health Center - Cardiac Rehabilitation),"18697 Bagley Road Middleburg Heights, OH 44130",41.370727,-81.8319943,Ohio,9313,22,29
Southwest General Health Center/Strongsville (Southwest General Health Center Cardiac Rehabilitation/Strongville),"18181 Pearl Road Strongsville, OH 44136",41.2870678,-81.8328908,Ohio,9076,22,28
Southwest Health (Southwest Health Cardiac Rehab Program),"1400 Eastside Rd Platteville, WI 53818-9800",42.7198321,-90.4581977,Wisconsin,580,6,7
Southwest Memorial Hospital (Cardiac Rehab),"1311 N Mildred Rd Cortez, CO 81321-2231",37.3621911,-108.5744372,Colorado,25,1,1
Southwest Mississippi Regional Medical Center (Cardiac Rehabilitation),"Southwest Center for Rehab 303 Marion Avenue McComb, MS 39648",31.2504864,-90.4737995,Mississippi,340,1,5
Southwestern Vermont Medical Center (Southwestern Vermont Medical Center Cardiac Rehabilitation),"100 Hospital Dr Bennington, VT 05201",42.8738397,-73.2079716,Vermont,709,4,5
Sovah Health-Martinsville (Sovah Health-Martinsville Cardiac Rehabilitation),"320 Hospital Dr CR Department Martinsville, VA 24112-1900",36.7000206,-79.8670343,Virginia,784,3,6
Sparrow Hospital (Sparrow Hospital Cardiac Rehabilitation),"1200 East Michigan Avenue, PO Box 30480 Lansing, MI 48909-7980",42.7331775,-84.5341536,Michigan,1163,5,8
Spartanburg Regional Medical Center (Spartanburg Regional Medical Center Heart Wellness Program Cardiac Rehab),"299 East Pearl Street Spartanburg, SC 29303",34.9658726,-81.9344086,South Carolina,2582,6,13
Speare Memorial Hospital (Speare Memorial Hospital Cardiac Rehab),"16 Hospital Road Plymouth, NH 03264",43.7577522,-71.6951638,New Hampshire,643,4,6
Spectrum Health Big Rapids Hospital (Spectrum Health Big Rapids Cardiac Rehabilitation),"605 Oak St Big Rapids, MI 49307",43.6938769,-85.4751018,Michigan,115,3,4
Spectrum Health Gerber Memorial (Spectrum Health Gerber Memorial Cardiac Rehab),"212 S Sullivan Ave Fremont, MI 49412-1548",43.4647642,-85.9514583,Michigan,480,5,5
