Fairmont Regional Medical Center (Fairmont Regional Medical Center Cardiac Rehab),"1325 Locust Ave Fairmont, WV 26554-1435",39.482633947164,-80.1654899185073,West Virginia,1507,5,8
Fairview Grand Itasca Clinic & Hospital (Fairview Grand Itasca Cardiac Rehab Phase II),"1601 Golf Course Road Grand Rapids, MN 55744",47.2177068,-93.5627708,Minnesota,84,2,2
Fairview Hospital (Fairview Hospital Cardiovascular Rehabilitation),"18101 Lorain Avenue Cleveland, OH 44111",41.4501501,-81.8239595,Ohio,8424,20,26
Fairview Hospital (Fairview Hospital Cardiac Rehabilitation),"29 Lewis Avenue Great Barrington, MA 01230",42.1910429,-73.3718828,Massachusetts,593,4,4
Fairview Lakes Medical Center (Fairview Lakes Medical Center Cardiac Rehab),"5200 Fairview Blvd Wyoming, MN 55092",45.3218275,-93.0000954,Minnesota,7420,18,21
Fairview Northland Medical Center (Fairview Northland Medical Center Cardiac Rehabilitation),"919 Northland Drive Princeton, MN 55371",45.5585269,-93.5900066,Minnesota,1458,4,8
Fairview Park Hospital (Rehab for Life),"200 Industrial Blvd. Dublin, GA 31021",32.5307736,-82.9514581,Georgia,334,1,4
Fairview Range Medical Center (Fairview Range Medical Center Cardiac Rehabilitation),"750 E 34th Street Hibbing, MN 55746",47.4094863,-92.9293996,Minnesota,258,2,2
Fairview Regional Medical Center (Fairview Regional Medical Center Cardiac Rehabilitation),"523 E State Rd Fairview, OK 73737-1453",36.2760386,-98.4745578,Oklahoma,85,1,4
Fairview Ridges Specialty Care Center (Fairview Ridges Cardiac Rehabilitation),"14101 Fairview Dr Ste 240 Burnsville, MN 55337-2522",44.7488559,-93.272816,Minnesota,7858,20,22
Fairview Southdale Hospital (Fairview Southdale Hospital Cardiac Rehabilitation),"6363 France Ave South Suite 100 Edina, MN 55435",44.8869116,-93.3262785,Minnesota,8486,21,23
Faith Regional Health Services (Faith Regional Health Services Cardiac Rehabilitation),"110 N. 29th Street. Suite 202 Norfolk, NE 68701",42.033852,-97.4540046,Nebraska,207,2,5
Fall River Health Services (Fall River Health Services Cardiac Rehab),"1201 Highway 71 S Hot Springs, SD 57747-8800",43.4172935,-103.4799902,South Dakota,37,1,2
Falmouth Hospital (Falmouth Hospital Cardiac Rehabilitation),"100 Ter Heun Drive Suite 100 Falmouth, MA 02540",41.5643088,-70.6222371,Massachusetts,1542,6,8
Family Health Center at NYU Langone - Brooklyn (Family Health Center at NYU Langone - Brooklyn Cardiac Rehabilitation),"150 55th St LB 3202 Brooklyn, NY 11220-2508",40.6466634,-74.0209235,New York,42708,46,107
Fauquier Health Wellness Center (Fauquier Health Wellness Center Cardiac Rehabilitation),"419 Holiday Court Suite 200 Warrenton, VA 20186",38.7230024,-77.7825164,Virginia,1926,4,11
Faxton St. Luke's Healthcare (Faxton St. Luke's Healthcare Cardiac Rehabilitation),"1676 Sunset Avenue Utica, NY 13502",43.0912796,-75.2582971,New York,852,2,6
Fayette Regional Health System (Cardiac Rehabilitation Program),"1941 Virginia Ave. Connersville, IN 47331",39.656435771054,-85.1324863589849,Indiana,561,6,7
Ferrell Hospital (Ferrell Hospital Cardiac Rehab),"1201 Pine St Eldorado, IL 62930-1634",37.8155011,-88.4420932,Illinois,193,2,6
FHN (FHN CARDIOPULMONARY REHABILITATION),"1045 W. STEPHENSON ST. FREEPORT, IL 61032",42.2949828,-89.6385509,Illinois,659,4,4
Fillmore County Hospital (Fillmore County Hospital Cardiac Rehabilitation),"1900 F St. PO BOX 193 Geneva, NE 68361",40.5269512,-97.5958818,Nebraska,104,3,5
First Health of the Carolinas - Pinehurst (FirstHealth of the Carolinas Center for Health and Fitness- Pinehurst Cardiac Rehabilitation),"170 Memorial Drive Center for Health and Fitness Piinehurst, NC 28374",35.2071511,-79.4601047,North Carolina,732,4,7
FirstHealth of the Carolinas Center for Health and Fitness- Sanford (FirstHealth of the Carolinas Center for Health and Fitness- Sanford Cardiac Rehab),"2925 Beechtree Dr Sanford, NC 27330-6934",35.5192345428597,-79.1858774437897,North Carolina,1703,7,6
FirstHealth of the Carolinas Center for Health and Fitness-Rockingham (FirstHealth of the Carolinas for Health and Fitness-Rockingham Cardiac Rehabilitation),"120 Richmond Memorial Drive Rockingham, NC 28379",34.9308081275064,-79.7496397142945,North Carolina,687,3,6
Fisher Titus Medical Center (Fisher Titus Medical Center Cardiac Rehabilitation),"272 Benedict Ave. Norwalk, OH 44857",41.2254465370116,-82.6036086319365,Ohio,1644,8,12
FITT Life PT (FITT Life PT Cardiac Rehab),"189 Littleton Rd Parsippany, NJ 07054-1842",40.8656142,-74.4209904,New Jersey,32407,36,79
Fitzgibbon Hospital (Buckner Wellness Center),"2305 S. 65 Highway Marshall, MO 65340",39.0915567,-93.2128672,Missouri,184,1,3
Flagler Hospital (Flagler Hospital Cardiac Rehabilitation Program),"120 Health Park Blvd. St. Augustine, FL 32086",29.8629648,-81.3205742,Florida,1274,6,6
Flagstaff Medical Center (Cardiac Rehab),"1200 N. Beaver Street Flagstaff, AZ 86001",35.2088271,-111.6439178,Arizona,268,1,1
Fleming County Hospital (Fleming County Hospital Cardiac Rehab),"55 Foundation Dr Flemingsburg, KY 41041-9815",38.4223084,-83.751672,Kentucky,435,3,6
Florida Hospital Fish Memorial (Cardiovascular Rehabilitation Program),"1055 Saxon Blvd. Orange City, FL 32763",28.91414,-81.2851695,Florida,6469,8,20
"Florida Hospital, DeLand (Cardiac Rehabilitation)","701 W. Plymouth Ave. DeLand, FL 32720",29.0437183,-81.317265,Florida,2882,5,13
Flowers Hospital (Cardiac Rehabilitation Program of Flowers Hospital),"4370 W. Main Street Ste 104 P.O. Box 6907 Dothan, AL 36302",31.2370999,-85.4571519,Alabama,983,2,6
Folsom Fitness & Rehab Center @ Methodist Dallas Medical Center (Cardiac Rehab Program),"1441 North Beckley Ave. Dallas, TX 75203",32.7611756,-96.8255271,Texas,12581,25,59
Forrest General Hospital (Forrest General Hospital - LiveWell Center Cardiac Rehabilitation),"5909 US Hwy 49, Suite 40 Hattiesburg, MS 39402",31.3098787,-89.3203771,Mississippi,1147,3,6
Forsyth Medical Center (Heart and Wellness Cardiac Rehabilitation),"3333 N Silas Creek Parkway Winston Salem, NC 27103",36.0753084,-80.2977215,North Carolina,4104,6,15
Fort Belvoir Community Hospital (Cardiology Clinic - Fort Belvoir Community Hospital),"9300 Dewitt Loop Fort Belvoir, VA 22060-5285",38.7053975,-77.1437196,Virginia,8634,16,28
Fort Health Care (Fort Health Care Cardiac Rehabilitation),"611 Sherman Ave. E Fort Atkinson, WI 53538",42.9313172,-88.8279388,Wisconsin,1205,11,14
Fort Loudoun Medical Center (Fort Loudoun Medical Center Cardiac Rehab),"423 Medical Park Suite 500 Lenoir City, TN 37772",35.8238425,-84.2688597,Tennessee,3743,9,10
Fort Sanders Regional Medical Center (Fort Sanders Regional Medical Center Cardiac Rehab),"501 20th Street Suite 110 Knoxville, TN 37916",35.9570821,-83.9382832,Tennessee,3767,9,10
Fort Walton Beach Medical Center (HCA Florida Fort Walton -Destin Cardiac Rehabilitation),"1020 Titan Court, Suite 101 Fort Walton Beach, FL 32547",30.4497445,-86.6336079,Florida,657,3,6
Frances Mahon Deaconess Hospital (Cardiac Rehabilitation),"621 3rd Street South Glasgow, MT 59230",48.1898492,-106.6362623,Montana,25,1,1
Franciscan Health Crawfordsville (Franciscan Health Crawfordsville Cardiac Rehab),"1710 Lafayette Rd Crawfordsville, IN 47933-1033",40.0663064,-86.9056642,Indiana,900,5,7
Franciscan Health Crown Point (Franciscan Health Crown Point Cardiac Rehab),"1201 S. Main St. Crown Point, IN 46307",41.3961378,-87.3644737,Indiana,6608,20,24
Franciscan Health Dyer (Franciscan Health Dyer Cardiac Rehabilitatiion),"24 Joliet St Dyer, IN 46311",41.4925378,-87.5244388,Indiana,12758,33,41
Franciscan Health Hammond (Franciscan Health Dyer Cardiac Rehabilitatiion),"24 Joliet St Dyer, IN 46311",41.4925378,-87.5244388,Indiana,12758,33,41
Franciscan Health Lafayette East (Franciscan Health Lafayette East Cardiac Rehabilitation),"1701 S Creasy Ln Lafayette, IN 47905-4972",40.3941973,-86.8353907,Indiana,925,4,8
Franciscan Health Olympia Fields (Cardiac Rehabilitation Program),"Heart and Vascular Institute 3800 West 203rd St Olympia Fields, IL 60461",41.522138,-87.7103008,Illinois,16729,43,54
Franciscan Health Olympia Fields (Franciscan Health Olympia Field Cardiac Rehab),"3800 W 203rd St Olympia Fields, IL 60461-1184",41.522138,-87.7103008,Illinois,16729,43,54
Franciscan Health Rensselaer (Franciscan Health Rensselaer Cardiac Rehab),"1104 E Grace ST Rensselaer, IN 47978",40.9349862,-87.1381787,Indiana,95,1,3
Franciscan St. Francis Health INDY (Franciscan Health Indianapolis Cardiac Rehab),"5255 E Stop 11 Rd Ste 230 Indianapolis, IN 46237-6341",39.649919,-86.0784099,Indiana,5225,11,22
Frankfort Regional Medical Center (Frankfort Regional Medical Center Cardiac Rehab),"299 Kings Daughter's Dr. Frankfort, KY 40601",38.160093,-84.9064527,Kentucky,2376,8,10
Franklin County Memorial Hospital (Cardiac Rehabilitation),"1406 Q St PO Box 315 Franklin, NE 68939-1073",40.0961242,-98.9525807,Nebraska,72,1,5
Franklin Memorial Hospital (Franklin Memorial Cardiac Rehabilitation),"111 Franklin Health Commons Farmington, ME 04938",44.6262135,-70.1631873,Maine,679,6,7
Frederick Health Hospital (Frederick Health Hospital Cardiac Rehab),"400 W 7th St Frederick, MD 21701-4506",39.4226989,-77.4146128,Maryland,1731,7,11
Frisbie Memorial Hospital (Frisbie Memorial Hospital Cardiac Rehabilitation Program),"11 Whitehall Road Rochester, NH 03867",43.2981782,-70.9607926,New Hampshire,1012,9,9
Froedtert Health Community Memorial Hospital (Cardiac Rehab),"Menomonee Falls, WI 53051",43.1397761,-88.1096118,Wisconsin,5900,16,30
Froedtert Hospital (Froedtert Hospital Cardiac Rehabilitation),"9200 W Wisconsin Ave Milwaukee, WI 53226-3522",43.0408429,-88.0246965,Wisconsin,6481,17,32
Froedtert Menomonee Falls Hospital (Froedtert Menomonee Falls Hospital Cardiac Rehabilitation),"W180 N8085 Town Hall Road Menomonee Falls, WI 53051",43.1640128,-88.1384415,Wisconsin,5840,16,29
Froedtert Moorland Reserve Health Center (Froedtert Moorland Reserve Health Center Cardiac Rehab),"4805 S Moorland Rd New Berlin, WI 53151-7401",42.9576951,-88.1113598,Wisconsin,6792,19,35
"Froedtert South, Inc. (Froedtert South, Inc. Cardiac Rehabilitation)","6308 8th Ave Kenosha, WI 53143-5031",42.5776152,-87.8201257,Wisconsin,3785,12,19
Froedtert West Bend Hospital (Froedtert West Bend Hospital Cardiac Rehabilitation),"3200 Pleasant Valley Road West Bend, WI 53095",43.3557741,-88.1953589,Wisconsin,5481,16,25
Frye Regional Medical Center (Frye Regional Medical Center Cardiopulmonary Rehabilitation Cardiac Rehab),"420 N Center St Hickory, NC 28601-5033",35.7375114,-81.3370193,North Carolina,1623,3,8
Fulton County Health Center (Fulton County Health Center Cardiac Rehabilitation),"725 S. Shoop Ave. Wauseon, OH 43567",41.5393346,-84.1328586,Ohio,2472,5,13
Fulton County Medical Center (Fulton County Medical Center Cardiac Rehabilitation),"214 Peach Orchard Rd. McConnellsburg, PA 17233",39.9372284,-78.0067842,Pennsylvania,761,5,7
Galesburg Cottage Hospital (Cardiac Rehab),"695 North Kellogg Street Galesburg, IL 61401",40.9556647,-90.3657881,Illinois,286,3,5
Galion Community Hospital (Galion Community Hospital Cardiac Rehabilitation),"269 Portland Way South Galion, OH 44833",40.7310249,-82.8021983,Ohio,1102,9,11
Garnet Health Medical Center (Garnet Health Medical Center - Catskills Cardiac Rehabilitation),"68 Harris Bushville Road Harris, NY 12742",41.7077527,-74.7344197,New York,805,3,6
Garnet Health System (Garnet Health Medical Center's Cardiac Rehabilitation Program),"707 E Main St Middletown, NY 10940-2650",41.4419177,-74.3680944,New York,2118,6,11
Garrett Regional Medical Center (Garrett Regional Medical Center Cardiac Rehabilitation),"251 North Fourth Street Oakland, MD 21550",39.413393,-79.4010325,Maryland,76,3,3
Gateway Regional Medical Center (Gateway Regional Medical Center Cardiac Rehabilitation),"2100 Madison Ave 2nd Floor, North Wing Granite City, IL 62040-4713",38.6992128,-90.1612668,Illinois,8097,17,31
Geary Community Hospital (Cardiac Rehab),"1102 St. Marys Rd. Junction City, KS 66441",39.0140681,-96.851104,Kansas,75,3,3
Geisinger Bloomsburg Hospital (HEARTS Cardiac Rehab),"549 Fair St Bloomsburg, PA 17815",41.009132,-76.4525127,Pennsylvania,1502,7,10
Geisinger Wyoming Valley (Geisinger Wyoming Valley Cardiac Rehab),"675 Baltimore Dr Entrance B Wilkes Barre, PA 18702-7900",41.2528575,-75.8024584,Pennsylvania,1734,5,8
Geisinger-Lewistown Hospital (Geisinger-Lewistown Hospital Cardiac Rehab),"400 Highland Avenue Lewistown, PA 17044",40.617946,-77.5673951,Pennsylvania,498,3,3
Geisinger-Shamokin Area Community Hospital (Geisinger-Shamokin Area Community Hospital Cardiac Rehab),"4200 Hospital Road Coal Township, PA 17866",40.8057257,-76.5706043,Pennsylvania,1392,6,10
Genesis Healthcare System (Heart & Vascular Rehabilitation),"2951 Maple Ave. Zanesville, OH 43701",39.9749736,-82.0171271,Ohio,785,4,4
Genesis Medical Center - Davenport (Genesis Medical Center Cardiac Rehabilitation),"1227 E Rusholme St Cardiac Rehabilitation Davenport, IA 52803-2459",41.54226,-90.5573,Iowa,2062,6,12
Genesis Medical Center - Silvis (Genesis Medical Center - Silvis Cardiac Rehab),"801 Illini Dr. Silvis, IL 61282",41.53664,-90.3925,Illinois,2039,5,12
Geneva General Hospital (Geneva General Hospital Cardiac Rehabilitation),"Geneva General Hospital 196 North Street Geneva, NY 14456-1651",42.87652,-76.9882,New York,628,5,6
George C. Grape Community Hospital (George C. Grape Community Hospital Cardiac Rehab),"2959 US Highway 275 Cardiac Rehab Dept Hamburg, IA 51640-5052",40.62064,-95.6507,Iowa,963,5,7
Georgetown Community Hospital (Georgetown Community Hospital Cardiac Rehabilitation),"1140 Lexington Rd. Georgetown, KY 40324",38.18664,-84.5613,Kentucky,2454,8,11
Georgetown Memorial Hospital (Georgetown Memorial Hospital Cardiac Rehabilitation),"606 Black River Rd Georgetown, SC 29440",33.37965,-79.2851,South Carolina,255,1,2
Georgia Arrhythmia Consultants (Georgia Arrhythmia Consultants Pace-Makers Cardiac Rehab),"639 Hemlock St Ste 100 Macon, GA 31201-6886",32.83186,-83.6337,Georgia,1550,5,9
Gerald Champion Regional Medical Center (Gerald Champion Regional Medical Center - Cardiac Rehab),"2669 N. Scenic Dr. Alamogordo, NM 88310",32.92643,-105.935,New Mexico,111,1,2
Gettysburg Hospital (Gettysburg Hospital Cardiac Rehabilitation),"147 Gettys Street PO Box 3786 Gettysburg, PA 17325-0786",39.82489,-77.2351,Pennsylvania,2147,8,12
Gibson Area Hospital (Gibson Area Hospital - Cardiopulmonary Rehabilitation),"1120 N Melvin St Gibson City, IL 60936",40.47853,-88.3702,Illinois,704,2,3
Glencoe Regional Health Services (Glencoe Regional Health Services Cardiac Rehabilitation),"1805 Hennepin Ave Glencoe, MN 55336",44.77838,-94.1527,Minnesota,294,4,6
Glendale Memorial Hospital (Dignity Health Glendale Memorial Hospital Cardiac Fitness Center),"1420 S Central Ave Fl 2 Glendale, CA 91204-2508",34.12809,-118.257,California,21968,15,97
Glens Falls Hospital (Cardiopulmonary Rehabilitation),"100 Park Street Glens Falls, NY 12801",43.3071,-73.6456,New York,562,2,2
Glenwood Regional Medical Center (Cardiac Rehabilitation),"503 McMillan Road West Monroe, LA 71291",32.51208,-92.1568,Louisiana,1184,3,12
Golden Valley Memorial Healthcare (Golden Valley Memorial Healthcare - Clinton Cardiac Rehabilitation),"1600 N. Second Street Clinton, MO 64735",38.38961,-93.7684,Missouri,130,3,3
Golden Valley Memorial Healthcare - Osceola (Golden Valley Memorial Healthcare Osceola Cardiac Rehab),"675 3rd St Osceola, MO 64776-2934",38.04688,-93.7023,Missouri,93,3,3
Golden Valley Memorial Healthcare - Warsaw (Golden Valley Memorial Healthcare - Warsaw Cardiac Rehab),"1771 Commercial St Warsaw, MO 65355-3096",38.26087,-93.3695,Missouri,56,4,1
Good Samaritan Dayson Heart Center (Good Samaritan Dayson Heart Center Cardiac Rehab),"520 S. Seventh St Vincennes, IN 47591",38.67276,-87.5329,Indiana,466,1,7
Good Samaritan Health Center (SCL Health Good Samaritan Medical Center Cardiac Rehabiliation),"300 Exempla Cir Ste 240 Lafayette, CO 80026-2906",39.96912,-105.087,Colorado,5801,15,25
Good Samaritan Hospital (Cardiac and Pulmonary Rehabilitation),"10 East 31st Street PO Box 1990 Kearney, NE 68848-1990",40.7074,-99.0818,Nebraska,302,4,4
Good Samaritan Hospital (Legacy Health: Good Samaritan Medical Center Cardiac Rehabilitation),"1015 NW 22nd Avenue, 97210 GSH Office Portland, OR 97210",45.53009,-122.698,Oregon,4551,12,16
Good Samaritan Hospital (Good Samaritan Hospital Cardiac Rehab),"15891 Los Gatos Almaden Rd Mission Oaks Campus Los Gatos, CA 95032-3742",37.24475,-121.948,California,4963,6,23
Good Samaritan Hospital Medical Center (Good Samaritan Hospital Medical Center Cardiac Rehab),"1000 Montauk Highway West Islip, NY 11795",40.69408,-73.2943,New York,11130,12,31
Good Samaritan Regional Medical Center (Good Samaritan Regional Medical Center Cardiac Rehabilitation),"3600 NW Samaritan Drive Corvallis, OR 97330",44.60346,-123.252,Oregon,875,5,6
Good Shepherd Medical Center (Christus Good Shepherd Health System Cardiac Rehabilitation),"707 E Marshall Ave Longview, TX 75601",32.50281,-94.7298,Texas,894,3,4
Good Shepherd Medical Center (Cardiac Rehabilitation),"610 NW 11th St Hermiston, OR 97838-6601",45.8466,-119.31,Oregon,173,2,4
Goodland Regional Medical Center (Cardiac Rehabilitation),"220 W. 2nd Goodland, KS 67735",39.35894,-101.715,Kansas,60,3,3
Goshen Hospital (Goshen Hospital Cardiac Rehab),"1855 South Main Street Suite B Goshen, IN 46526",41.56366,-85.829,Indiana,1410,7,12
Gothenburg Memorial Hospital (Cardiac Rehabilitation),"910 20th Street Gothenburg, NE 69138",40.9389,-100.153,Nebraska,71,1,4
Grady Memorial Hospital (OhioHealth Cardiac Rehab - Grady Memorial Hospital),"561 West Central Ave Ground Floor Suite 76-0002 Delaware, OH 43015",40.30581,-83.0897,Ohio,5241,16,13
Graham Cardiopulmonary Rehab (Graham Cardiopulmonary Rehab - Cardiac),"180 S Main St Canton, IL 61520-2608",40.55379,-90.0359,Illinois,1386,5,6
Grand Strand Medical Center (Grand Strand Medical Center Cardiac Rehabilitation),"809 82nd Parkway Myrtle Beach, SC 29572",33.75849,-78.82,South Carolina,917,4,5
Grand View Health (Grand View Health Cardiac Rehabilitation),"700 Lawn Ave. Sellersville, PA 18960",40.36311,-75.3265,Pennsylvania,12555,21,46
Grandview Medical Center (Grandview Cardiac Rehabilitation),"3690 Grandview Pkwy Fl 2 Birmingham, AL 35243-3326",33.43295,-86.718,Alabama,4064,9,9
Grant Medical Center Cardiac Rehabilitation (Outpatient Cardiovascular Rehabilitation),"340 E. Town St. 9th Floor Columbus, OH 43215-4600",39.95998,-82.9911,Ohio,5821,20,17
Grant Regional Health Center (Grant Regional Health Center Cardiac Rehabilitation),"507 South Monroe Street Lancaster, WI 53813",42.84409,-90.7089,Wisconsin,580,6,7
Grayling Mercy Hospital (Grayling Mercy Hospital - Cardiac Rehab),"1100 Michigan Avenue Grayling, MI 49738",44.66837,-84.7069,Michigan,125,3,3
Great Plains Health (Great Plains Health Cardiac Rehabilitation),"601 West Leota PO Box 1167 North Platte, NE 69101",41.12181,-100.771,Nebraska,116,1,1
Greater Regional Medical Center (Greater Regional Medical Center Cardiac Rehab),"1700 W Townline St Creston, IA 50801-1054",41.07033,-94.384,Iowa,113,3,5
Greene County General Hospital (Greene County General Hospital Cardiac Rehab),"1185 N 1000 W Linton, IN 47441-5282",39.04086,-87.1304,Indiana,130,1,3
Greene County Medical Center (Greene County Medical Center Cardiac Rehabilitation),"1000 West Lincolnway Jefferson, IA 50129",42.016,-94.3882,Iowa,241,3,6
Greene County Memorial Hospital (Kettering Health Greene Memorial),"1141 N. Monroe Drive Xenia, OH 45385",39.70036,-83.9278,Ohio,3644,8,16
Greeneville Community Hospital East (Greeneville Community Hospital East Cardiac Rehabilitation),"1420 Tusculum Blvd Greeneville, TN 37745-4279",36.17282,-82.7907,Tennessee,1611,5,8
Greenville Memorial Hospital (Prisma Health-Upstate Greenville Memorial Hospital HeartLife Cardiac Rehab),"875 West Faris Rd Greenville, SC 29605",34.81699,-82.4071,South Carolina,2588,8,11
Greenwich Hospital (Greenwich Hospital Cardiac Rehab),"500 West Putnam Avenue 3rd Floor Greenwich, CT 06830-6074",41.01793,-73.6453,Connecticut,36249,40,91
Greenwich Hospital (Center For Healthy Living),"6275 Tweedholm Court San Jose, CA 95120",37.22323,-121.885,California,4723,6,21
Greenwood Leflore Hospital (Greenwood Leflore Hospital Cardiac Rehabilitation),"1401 River Road Greenwood, MS 38930",33.51752,-90.2,Mississippi,484,2,6
Greer Memorial Hospital (Pulmonary Rehabilitiation),"315 Medical Parkway Suite 250 Greer, SC 29650",34.92063,-82.2435,South California,2393,7,12
Griffin Hospital (Griffin Hospital Cardiac & Pulmonary Rehabilitation),"130 Division St Derby, CT 06418-1326",41.33513,-73.089,Connecticut,7025,19,19
Gritman Medical Center (Gritman Cardiac Rehabilitation),"700 S. Main Moscow, ID 83843",46.72874,-117.001,Idaho,241,2,5
Grove County Medical Center (Gove County Medical Center - PAD SET Program),"520 W 5th St Quinter, KS 67752-9705",39.06762,-100.241,Kansas,79,1,4
Grove Hill Memorial Hospital (Healthy Hearts Cardiac Rehabilitation Program),"295 South Jackson P.O. Box 935 Grove Hill, AL 36451",31.69464,-87.7763,Alabama,114,1,3
Grundy County Memorial Hospital (Cardiac Rehabilitation Program),"201 East J Avenue Grundy Center, IA 50638",42.35937,-92.7621,Iowa,940,5,7
Guadalupe Regional Medical Center (Guadalupe Regional Medical Center Cardiac Rehab),"Guadalupe Regional Medical Center 1215 E. Court St. Seguin, TX 78155",29.56808,-97.9467,Texas,1161,3,7
Gundersen Boscobel Area Hospital and Clinics (Gundersen Boscobel Area Hospital & Clinics Cardiac Rehab),"205 Parker St Boscobel, WI 53805-1642",43.13337,-90.7082,Wisconsin,100,4,4
Gundersen Health System (Gundersen Health System Cardiac Rehab),"1900 South Avenue Mailstop: H06-002 La Crosse, WI 54601",43.7948,-91.2475965,Wisconsin,755,6,5
Gundersen Palmer Lutheran Hospital & Clinics (Gundersen Palmer Lutheran Hospital & Clinics Cardiac Rehab),"112 Jefferson Street West Union, IA 52175-1022",42.96832,-91.81,Iowa,168,3,7
Gundersen Saint Elizabeth Hospital & Clinics (Gundersen St. Elizabeth's Cardiac Rehabilitation),"Gundersen St. Elizabeth's Hospital 1200 Grant Boulevard West Wabasha, MN 55981-1098",44.38832,-92.0486,Minnesota,118,4,4
Gundersen Sparta Clinic (Gundersen Sparta Clinic Cardiac Rehabilitation),"1111 W Wisconsin St Sparta, WI 54656-2233",43.93824,-90.8265,Wisconsin,756,6,6
Gundersen St. Joseph's Hospital and Clinics (Gundersen St. Joseph's Hospital Cardiac Rehabilitation),"400 Water Ave Attn: Kaitie Baumann Hillsboro, WI 54634-9054",43.64863,-90.3451,Wisconsin,165,7,6
Gundersen Tri-County Memorial Hospital (Gundersen Tri-County Hospital Cardiac Rehab),"18601 Lincoln St Whitehall, WI 54773-8605",44.36448,-91.3186,Wisconsin,117,3,4
Guthrie Cortland Medical Center (Guthrie Cortland Medical Center Cardiac Rehab),"134 Homer Ave Cortland, NY 13045",42.60884,-76.1876,New York,1252,3,5
Gwinnett Hospital System (Gwinnett Cardiac Rehab Program),"1000 Medical Center Blvd. Lawrenceville, GA 30046",33.96352,-84.0183,Georgia,7903,15,22
Habersham Medical Center (Habersham Medical Center Cardiac Rehabilitatioin),"541 Historic HWY 441 N P.O. Box 37 Demorest, GA 30535",34.55826,-83.5257,Georgia,1088,4,8
Hackensack Meridian Health Network (Hackensack University Medical Center Cardiac Rehabilitation),"20 Prospect Avenue Suite 200 Hackensack, NJ 07601",40.88325,-74.057,New Jersey,41943,47,106
Hackensack Meridian Health Pascack Valley Medical Center (Hackensack Meridian Health Pascack Valley Medical Center Cardiac Rehabilitation),"250 Old Hook Rd Westwood, NJ 07675-3123",40.98538,-74.0151,New Jersey,39694,43,99
Hackensack Meridian Mountainside Medical Center (Hackensack Meridian Mountainside Medical Center Cardiac Rehab),"1 Bay Avenue 1st Floor Montclair, NJ 07042",40.81175,-74.2037,New Jersey,41248,45,101
Hackettstown Medical Center (Hackettstown Medical Center Cardiac Rehabilitation Program),"651 Willow Grove Street Hackettstown, NJ 07840",40.86194,-74.8158,New Jersey,4493,14,16
Hamilton Healthcare System (Hamilton Healthcare System Cardiac Rehabilitation),"400 N. Brown St. Hamilton, TX 76531",31.70323,-98.114,Texas,50,1,2
Hammond-Henry Hospital (Cardiac Rehab),"600 North College Ave Geneseo, IL 61254",41.46007,-90.1578,Illinois,1952,6,11
Hannibal Regional Hospital (Hannibal Regional Hospital Cardiac Rehabilitation),"6000 Hospital Drive Hannibal, MO 63401",39.7115,-91.4518,Missouri,471,3,3
Harbor Regional Health (Harbor Regional Health Cardiac Rehab),"915 Anderson Dr Aberdeen, WA 98520-1006",46.97983,-123.847,Washington,63,2,3
Hardin Medical Center (Hardin Medical Center Cardiac Rehabilitation),"935 Wayne Rd Ste B Savannah, TN 38372-1919",35.22797,-88.2299,Tennessee,331,2,4
Harrison Community Hospital (Harrison Community Hospital Cardiac Rehabilitation),"951 E Market St Cadiz, OH 43907-9799",40.2576,-80.9778,Ohio,1196,6,9
Harrison County Hospital (Harrison County Hospital - Cardiac Rehab),"1141 Hospital Dr, NW Corydon, IN 47112",38.23713,-86.1455,Indiana,4226,15,13
Harrison Medical Center Bremerton (Saint Michael Medical Center Cardiac Rehabilitation),"1780 NW Myhre Rd Suite # SDG 230 Silverdale, WA 98380",47.65555,-122.676,Washington,4541,11,24
Hartford Hospital - Henry Low Heart Center (Hartford Hospital Cardiac Rehabilitation),"85 Seymour St Suite 607 Hartford, CT 06107",41.75446,-72.6815,Connecticut,6013,23,18
Hartford Hospital - Henry Low Heart Center - Glastonbury (Hartford Hospital Cardiac Rehabilitation Glastonbury),"628 Hebron Ave. - Bldg. 1 - 2nd Fl. Glastonbury, CT 06033",41.71314,-72.5871,Connecticut,6226,24,19
Hartford Hospital Henry Low Heart Center at Avon Wellness Center (Hartford Hospital/Avon Cardiac Rehab),"100 Simsbury Road Suite 102 Avon, CT 06001",41.81723,-72.8292,Connecticut,6102,23,18
Havasu Regional Medical Center (Havasu Regional Medical Center Cardiac Rehabilitation),"101 Civic Center Lane Lake Havasu City, AZ 86403",42.56549,-84.8319,Arizona,1344,6,10
Hayes Green Beach Hospital (Hayes Green Beach Hospital- Cardiac Rehab),"321 E. Harris St Charlotte, MI 48813",38.88223,-99.2974,Michigan,72,1,3
